Numu - New Music Tracker - Alerts for New Music Releases,mobile app,m.theappplug,"Numu Tracker can keep you up to date on music by the artists you love the most. Part to-do list, part reminders, and alerts, Numu gives you the tools to ensure you never miss out on new albums. The main view of Numu shows you a list of the most recent albums and EPs released to date."
Supbot - SUPREME CHECKOUT BOT for iOS - Stop taking L's every Supreme drop and start taking W's with the original iOS Supreme Bot!,mobile app,m.theappplug,"Why use Supbot rather than a supreme bot on the computer? - Faster than bots on computers - Developed with efficiency in mind, causing for an extremely fast bot - Use LTE and Supreme mobile website for faster checkout - Affordable - Portable Main features: - Fully automated bot (NOT just an autofil.."
Hoods Map - Explore New Neighborhoods,mobile app,m.theappplug,Coming soon.
USIC RADIO - Podcasts - 100+ Undiscovered Podcasts,mobile app,m.theappplug,"USIC RADIO is a mobile application highlighting over 100+ podcast channels from all over the world including USIC's premiere flagship college radio station ""No Long Talking"" out of the University of Cincinnati and popular channels like No Jumper, ESPN, TED Talks, and more. Listen to educational & ne.."
"Trade'Em - Trade’Em is a cool free app that connects merchants, customers, friends, and family with free stuff.",mobile app,m.theappplug,"What is Trade'Em, and how does it work? We allow you to store digital gift cards, punch cards, and free promotional items from your favorite merchants inside our app! This app provides a truly unique experience because every promotional item from the merchant is totally free! You can send gifts via.."
"Beautify - On Demand - Beautify is On-Demand beauty service app for your hair, nails, makeup, eyelashes and facials.",mobile app,m.theappplug,"Beautify brings beautifying services directly to you! The Beautify app gives you control at your fingertips to request On-Demand hair, nails, makeup, eyelashes, and facials whenever wherever you need! Simply sign up, pick a time and date to schedule an appointment, we'll have a vetted professional.."
"WPLMS Online Courses App - Join WLPMS to be one of the millions who are training, learning, and acquiring new skills to advance there careers/businesses.",mobile app,m.theappplug,"WPLMS is an online learning platform featuring 100,000+ video courses taught by vetted instructors. Take courses in anything from programming languages like Tcl, and Java to personal development classes like design, art, photography, and yoga. Join the more than 24 million online students who are ac.."
AMPLIFY MUSIC STREAMING - Stream Undiscovered Music,mobile app,m.theappplug,AMPLIFY Music is a music player for YouTube videos and playlists. Highlighting the best-undiscovered music in a beautifully designed interface! We have built AMPLIFY to adhere to all of YouTube's API requirement so AMPLIFY does NOT offer the ability to download music. Here's a brief overview of AMPL..
"Elyte - Luxury, Unique Car Rentals - ELYTE - The first to provide luxury, unique, exotic car rentals On-Demand",mobile app,m.theappplug,"ELYTE is a first of its kind on-demand luxury car-rental service application. Discover and find the best prices and frequent availability of cars in your city. Finally, you're able to rent 1000's of cars from; Tesla to Classic cars, hassle-free with a tap of your finger."
"Down4 - College Event Finder - Down4 is social media app where college students can post, find and celebrate at college events.",mobile app,m.theappplug,"Down4 is a new social media app where college students can post, find and have fun at college oriented events. What are you Down4? • Find the college events happening around you • Join an event's attendee list • Check-in at the event once arrived • Post pictures, videos and comments onto the live fe.."
"Down4 - College Event Finder - Down4 is social media app where college students can post, find and celebrate at college events.",mobile app,m.theappplug,"Down4 is a new social media app where college students can post, find and have fun at college oriented events. What are you Down4? • Find the college events happening around you • Join an event's attendee list • Check-in at the event once arrived • Post pictures, videos and comments onto the live fe.."
Michael - Taxomate is an automated cloud-based service used by Amazon merchants to import their Amazon sales and fee transactions and to post summarized transactions to Xero or QuickBooks accounting systems.,other,michael,taxomate makes it easy for you to import Amazon marketplace transactions into QuickBooks Online. Once imported into QuickBooks you can easily reconcile the transactions with bank deposits received from Amazon. taxomate journals posted to QuickBooks will match perfectly against the corresponding depo..
TiltSwitch - Tiltswitch is a way to show case your talent and instantly connect with creative individuals world-wide.,mobile app,m.theappplug,"Use TiltSwitch to: - Post photos, music, and videos you want to keep on your grid. - Browse for talented artists and musicians on our homepage. - Collaborate with artists using one easy button."
Helix Jump - Amazing game to play in helix jump,mobile app,aqualabgames,"Interminably slide down the helix, however be watchful, you are not a child any longer! Hop over the pits and hindrances, stay away from objects shooting at you. Bit your highscore and rival others to hit the best score on the planet like the ninja hop!  On the off chance that you like Helix Jump: .."
Fashion Noval - Strong exponential sales growth and predictable revenue stream.,website,ecommillion,• Fashion Noval is an e-commerce store in the business of dropshipping trending fashion worldwide. (you do not need any warehouse!)   • Professional theme - $180 value   • I will show hot to collaborate with affiliate partners who can promote your products on their Blogs or Instagram FOR FREE! ..
LocalGoogle - Offline websites search engine,desktop app,kodejuice,A minimalistic search engine that saves you the stress of manually going through your offline websites looking for information.
Hospital Management - This project Manage Your Hospital Appointments with in one click.,website,dreamer,"A hospital information system (HIS) is an element of health informatics that focuses mainly on the administrational needs of hospitals. In many implementations, a HIS is a comprehensive, integrated information system designed to manage all the aspects of a hospital's operation, such as medical, admi.."
govt_exam notes - govt_exam practise site,other,nikita,"This project is created for the online reader and offline reader In this project we have provided study material for the reader who are interested to face the Competitive Exam of BANK,SSC,RAILWAY with the description of the answer and simple tricks to solve it."
alwayshyped - Shopify Dropshipping Business,website,sheikh786,"Looking to get into Drop Shipping in one of the most profitable niches in the market? ALWAYSHYPED is a fully customized store that will make it easy for you to start making money online today. With Drop Shipping you won’t have to hold any inventory, or make any payments for products until you receiv.."
taxomate - Automate Your Amazon FBA Seller Accounting Software,website,taxomate,taxomate is an automated cloud-based service used by Amazon merchants to import their Amazon sales and fee transactions and to post summarized transactions to Xero or QuickBooks accounting systems.
Best Guide About Online Casino - It is an ambitious project that includes all information about online casinos and is actively working on the information development of this area.,website,kisslotka,"On website Bgaoc you can step-by-step look at how create account, deposit and make bets in online casinos for real money. As examples we will take real conditions that you will encounter playing gaming games."
Gift India Hub,website,giftindiahub,"GiftIndiaHub. com is e-Commerce start-up which helps the consumer to provide online gifts, flowers & cakes."
UltrasoundHQ.com - Premium Audio Equipment Dropshipping Business,website,burnsdigitalco,Website: https://www. ultrasoundhq. com Describe your product Premium Home Entertainment Dropshipping store with over 300 products.
Bitcoin Tax - Tax,website,deanricky418,Worried about bitcoin tax? Join our course and become a certified crypto tax expert. Grow your revenue from millions of taxpayers who have traded or earned cryptocurrency.
Office Error Code Solutions - Find the Step-by-Step guide to resolve the Microsoft Office Error Codes,website,ccr,"officeerror. com has most general and common errors of Microsoft Products and their resolution steps. Here you will find all step-by-step guide for office error code, so can resolve your issues with minimal effort."
Summer Beat - Latest swimsuits for 2018 with goal of empowering woman body love,website,dzenanahh,Latest swimsuits for 2018 with goal of empowering woman body love.
"two years old freelance IT service marketplace - Codestunts is the first marketplace that applies the uber's payment model into online freelancing. It's powered by stripe's ""connect"" feature and fully complies with USA/EU money transaction laws.",website,psychip,Screencast from onboarding to payment: https://www. youtube. com/playlist?list=PLt3mBTq2wSkUXraVOw2biesnqpgdUW5Ad   Technical information: https://docs.
MakCorps - Hotel Price Comparison API,website,makcorps,"This API lets you compare hotel room prices from more than 200 websites like agoda. com, booking. com , hotels."
"Ionic Clothing Mobile App - A complete E-Commerce application for online clothing store. This aids in creating amazing Clothing Mobile app with special features which lets your customer to shop easier, faster, and hassle-free.",website,ccr,"Ionic Clothing Mobile App A complete E-Commerce application for online clothing store. This aids in creating amazing Clothing Mobile app with special features which lets your customer to shop easier, faster, and hassle-free. Lets your customer shop and make payment, register, login, view order stat.."
shopping portal - shopping website,other,nikita,It is a e-commerece website. well build. there is two module user/admin e-commerce website of shopping poratal in php.
Evenli - eInvitation for your modern guests.,website,skadimoolam,Evenli is a simple e-invite generator. Features Unique page for every event QR code for social media sharing Google Map directions to the event place SEO friendly event page.
MINGL -modern Dating App with micro-Location feature (like Happn) - MINGL introduces you interesting people from your area and even shows the people that you see in your everyday life and makes it possible to meet them again.,mobile app,fbischof,"because I started another startup, I dont have time to continue this dating app named ""MINGL"". The USP of this app is that the app recognize people which have met in real life in background (geo-fencing). This feature is etablished successfully in some other apps (Happn, Spotted)."
Custom stickers wholesale printing,website,stickerprintingshop,"Get custom printed stickers at lowest wholesale rates online anytime. You can order custom printing services for any type of stickers, labels and decals as well."
Eastwood - Well designed dropshipped ecomerce store,website,dene studios,Eyewear has become a steadily increasing market within the United States. The total amount of eyewear sold throughout the country has increased every year since 2009. In 2015 the United States generating about 34.
PacBell customer care - Pacbell customer care phone number 1-800-23-6190,other,sharonsmith45,"If you are not able to send an email via your PacBell webmail, you need to get help. Ask the customer care team to resolve your problems. Whenever you want you can try PacBell customer care number 1-800-23-6190 and find the solution."
Java Swing - Administration UI 2018 [KeepToo_S_Dashboard] - A Java Swing UI with a modern taste.,desktop app,keeptoo,"A Java Swing UI with a modern taste. What's new: Full tabs with functionality Editable data straight from Jtable Added border line to JFrame to highlight the frame on white background New icons. New search textbox In this app, you can do manage students, teachers and users of the system usi.."
SlotStory - Online gambling web site,website,jenniepinto,"SlotStory is a simple gaming web site, where you can find differnt slots for your own taste. We are happy to improve our products for you. Our games are design to make you much wins."
Hookdoo - Use incoming webhooks to run shell scripts on your remote servers.,website,adnanh,We provide you with secure webhook invocation endpoints that can run your shell scripts by connecting to your fleet of servers via SSH. Main features: - Use request context in your script code - Detailed webhook invocation history - Custom trigger rules - Hook invocation replay - Various concur..
BEST School Website script in PHP/MYsql - Launch your school website at a go,website,torrahclef,"THis project is in PHP and its a complete school website script which is good for High school and colleges. TEACHErs MANagement, Student's MAnagement, COurse MAnagement, FACUlty MAnagement, EMAil Subscription, BLOg & EVENts, Online Admission FORM, and lots more. THis project is just $20 You .."
"Campus based Android application - This project consist of 3 android app as 1 for student , 1 for faculty and 1 for Event organizer.",mobile app,dreamer,you can check application further description from here => https://dreamhunterztech. wixsite. com/cgcstudentportal   This app consist of : •  Campus Newsfeed :  Now you can easily access all the updated Campus Newsfeeds right away just with one tap.
Home automation with raspberry pi using voice control via Android phone and via Windows program,other,zlab,Home automation based on raspberry pi board as a getaway. The user can control  the entire  home in two ways- by using voice control via Android phone and by using Windows PC application. The communication with the gateway is over LAN / Wi Fi.
taxomate - Amazon Accounting Made Easy,website,taxomate,taxomate is an automated cloud-based service used by Amazon merchants to import their Amazon sales and fee transactions and to post summarized transactions to Xero or QuickBooks accounting systems.
"PPC Life Insurance Website For Sale - 10 year Life Insurance Website with 15,800 page views/mo averaging $ 1,300+ per month in PPC revenue!",website,winstanleyf1,"How it works: Currently and for the past few years people visit this website landing page for quotes or rates on life insurance, they type in their zip-code and on the next page up comes the advertisers in their local area. (See screenshots) You are paid on a pay-per-click basis, (each time a perso.."
Elsa Hosk Victoria's Secret Angel - Elsa Hosk swedish model FanSite,website,zaussie,"Elsa Hosk Swedish model Fansite Established June 2015 Over 400 articles (News, Interviews, Campaigns, Magazines, Videos, VS appearances)."
"Auto Insurance PPC website for sale! - 2.5 Year Auto Insurance Website with 8,200 page views/mo averaging $ 1,500+ per month in PPC revenue!",website,winstanleyf1,"How it works: Currently and for the past few years people visit this website landing page for quotes or rates on auto insurance, they type in their zip-code and on the next page up comes the advertisers in their local area. (See screenshots) You are paid on a pay-per-click basis, (each time a perso.."
dedend - dedend free vector graphics resources.,website,dedend,"dedend. com is a unique place, where you can search for inspirations and download for free, ideas within a carefully prepared vector graphics. It's a one of a kind website and an experimental playground for vector art-related projects."
Rainmeter Skins,website,david,Rainmeter is a software which basically allows you to display customizable skins in your desktop.
Watchkarter - Ecommerce dropshipping store of watches.,website,ujjwalverma,Watchkarter is an online dropshipping store with 80+ products added. It sells watches. The cost of one watch is around $30 to $60 and profit margin is minimum $20.
Aajtak jagran - Is an Automated news blog with latest hindi news,website,ujjwalverma,Aajtak jagran is an auto blog about latest news in hindi. It runs on autopilot so you don't need to post any article on it daily news about india is automatically posted on the blog you can edit the posts to make it seo friendly. Aajtak jagran has 100 pageviews per day.
FUN ANDROID / IOS GAME - WITH GOOGLE PLAY CONSOLE ACCOUNT - Simply android / ios game created on Unity - C#,mobile app,tadeaskaba,Simple but very fun game created on Unity. Game is primary targeting for Android but could be built for IOS or else platforms. Everybody who played this said that is very good game.
Thecustompackagingboxes.com - Custom Printed Packaging Boxes wholesale,website,printcosmoprinting,Packaging is mandatory for every type of business. Get high quality printing and packaging services by thecustompackagingboxes. com with free home delivery.
Studiotime - Airbnb for music studios,website,mawilliams1215,"Studiotime has been called the ""Airbnb for music studios"" and also featured in Forbes, Hypebeast, Fader, Complex, BBC and more media. It has music studios in over 35+ countries and you can check out more at www. studiotime."
LuxuryStyle Life Shop - New Clothing Brand,website,mohamedhadi ferjani,i creat this store to start a new luxury clothing brand i have good domain name it's catchy  i will includ in the sale the doamin name + instagram account and facebook page the brand is new so we did'nt make any sale and we didin't start any ads.
Bitcoin and Crypto Currencies exchange sites - Crypto Exchange Sites,website,branddomains,"Looking for a co-founder for crypto exhange sites targeting European, Greek and Brazilian crypto market. Domain already register and we have start working wordpress. I need a co-founder or team with experience Sites : BITCOIN."
Lipstick boxes - Get custom printed lipstick Boxes at lowest prices,website,printcosmoprinting,are you looking for cometic boxes? Find high quality packaging for cosmetics especially for lipstick packaging boxes at lowest prices you have ever got before.
Custom Dropshipping Sales Funnels (Bonuses Included) - Custom Automated Dropshipping Trending Product Sales Funnel with bonus funnels included,website,eddy,I've done extensive research and used paid tools to identify current trending products that are perfect for dropshipping and have built a fully custom and automated sales funnel using paid software to bring high-conversions and help you make more sales. INCLUDES: Funnel in URL along with proven F..
TripTattoos - Tattoo Social Network,mobile app,lubilis,"TripTattoos is a the social network where users can discover new tattoos and upload theirs! There are many tattoo artists sharing their works through iOS/android mobile apps and they're visible on triptattoos. com website too. Users can comment or save and give a preference on each tattoo, according.."
JobCompass - Local and location based job search app.,mobile app,smallsuccess,JobCompass has been around since 2009 as a side project and has been featured in multiple news and media outlets including Mens Health. I have a steady flow of job searches every month and some income. I am selling the website and the app (both for iOS and Android).
meqem - Forecast as a Service,website,meqem,Developer-first service to forecast any (non-random) time series data thanks to artificial intelligence.
Stock Broker Game - App and Online stock broker game,mobile app,smallsuccess,"iOS, Android and Online Stock Broker Game. Over 20,000 registered users."
LiveCls - E-Learning Platform That Connects Instructors and Students,website,bassem,LiveCls:  E-learning solution that connects instructors and students. It's provides complete tools to create courses and live classes through online classroom. Livecls.
Plimpa - The most effective location-based marketplace,website,plimpa,Plimpa is the world's largest location-based marketplace: - buyer can buy from the multiple sources of relevant ads - sellers have a unique tools to increase their reach IMPORTANT: you can't see the content unless you have a Thai IP address(IP-based localization). Please contact me / use VPN/Proxy..
Bahahro - a Website & Design Studio for Sale,website,takethisout,"Hello, I'm selling Bahahro a web and graphic design studio. I started Bahahro back in March. Unfortunately, I don't have the time to manage it anymore."
My Box Printing - Eco-Friendly Packaging Solutions,website,myboxprinting,Get custom boxes from My Box Printing. We offer custom design and layout options. Just tell your requirments and let the rest do for you.
Brand Domains Club - Brandable and Valuabele Domains Marketplace,website,branddomains,"BrandDomains. org is a Brandable, Keyword and Valuabele Domains Marketplace. I sell this online business to run my new ICO project."
universal-heroes - Scallable DC Marvel ECommerce Business For Sale,website,sousou75,"www. universal-heroes. com was developed to run with no technical knowledge; the website is easy for the new owner to themselves change prices, add and remove products and to run their own eCommerce business from home, from a café or whilst on the move."
Jewellery Boutique - Scallable Jewelry ECommerce Business For Sale,website,sousou75,"www. chez-sophie. com was developed to run with no technical knowledge; the website is easy for the new owner to themselves change prices, add and remove products and to run their own eCommerce business from home, from a café or whilst on the move."
Use This Price - Bitcoin Price Index - As a Service,website,use this price,Tracks the top 4 exchanges in terms of volume - to get a index price for Bitcoin. Can we use as a json service as well.
MLM - Multilevel Marketing System - MLM - Multilevel Marketing System,website,torrahclef,"About MLM - Multilevel Marketing System - top Our ""MLM"" software is for multi-levels Business, it's perfect for all MLM businesses that want to administrate their users and give the opportunity to each user to have a virtual wallet. You can also have a referral & 1:1 Pair Binary Matching system and.."
Infinite blog-magazine script (PHP) - Infinite blog-magazine script (PHP),website,torrahclef,"Infinite is a multi-purpose blog-magazine script. It has clean, responsive and user-friendly design. You can manage your posts, custom pages, categories, user comments, advanced settings and contact messages with its powerful Admin panel."
Easy POS and Inventory Managment System (PHP) - Point Of Sale,website,torrahclef,All Modules are available in full source code. Purchase at just $10 (Whatsapp +2348138652645 / www. lykup.
CleverBrush - Online vector editor and photo collage builder,website,cleverbrush,A web based tool which will give your customers ability to create gorgeous designs.
pokemon4free E-commerce Business - Very Profitable Pokemon E commerce Business For Sale,website,sousou75,"www. my-pokemon4free. com was developed to run with no technical knowledge, the website is easy for the new owner to themselves change prices, add and remove products and to run their own eCommerce business from home, from a café or whilst on the move."
Olives jewelry box - Successful start up ready to rock and roll!,website,olivesjewelrybox,"Olives Jewelry Box is a start up ready to sell online jewelry beautique loaded with amazing handpicked jewelry. It is already set up with tons of drop shipping apps, marketing apps, and any other app you can think of. This store just needs a little love and its going to be a huge success."
"Online Book Store - Market your Book This is a Basic App support Book upload and download , pdf viewer within app , files hiding feature and also offline book handling capability.",mobile app,dreamer,"watch Demo  Video in youtube from this link= > https://youtu. be/0asyi3cVUwM. As , this project have features  : To upload Books in pdf form."
"Email Verification directly on Google Sheets - An add-on for bulk email verification directly on Google Sheets, where you have contacts collected",other,dimamoldav,Describe your product Email Verification Tool is an add-on that allows bulk email verification directly on Google Sheets where you have contacts collected. Why are you selling the business? We are working on a new big project and need money to invest in it. What is included in the sale? The add..
Egg O - A new addictive tap game on android,mobile app,mot1baba,Just tap to dodge every pot and save the baby egg and have fun.
"PawCrates.com - 1/yr old Dog Supplies Business, Generating $50/pmo",website,burnsdigitalco,What is included in the sale? Domain: https://www. pawcrates. com Complete  website files & databsae Email List What is required to keep the business operational? 1-2 hours a month processing orders Website hositng Sales are coming from completely organic traffic Why are you selling th..
"ProExpense -- Expense tracking chatbot - Finally, detailed expense tracking from the convenience of FB messenger",mobile app,camboblaine,"I developed an expense tracking chatbot that has great engagement with users. This would be primarily for people who contractors, real estate agents, free lancers, and people who use cash. Competetiors to this chatbot are charging $60/yr."
BittPress - Cryptocurrency Google News Website,website,joelpicardo,Cryptocurrency Google news approved website with around 40 articles. The articles have been written after a lot of research in this industry. Buyer will have the potential to make it a huge cryptocurrency news website and earn money via Adsense and paid promotion.
