"KikQuiz - Viral Online Fun Quizzes, Horoscopes and Facebook Apps",website,razvan,"Quiz Apps Website Like NAMETESTS, QUIZSTAR *NO RESERVE* Want to have a website like nametests, quizstar and all those Facebook viral tests? Here is your great opportunity to own yours with READY CONTENT READY TO GO! * NO RESERVE * Have you ever seen your friends sharing posts like “Where should yo.."
Walker Wayland AMD - Your team of Chartered Accountants and Business Advisors,website,walker wayland,"As one of the largest accounting, auditing, and business services in Western Australia's Peel region, we have offices in Mandurah and Pinjarra. There we work with local businesses and people to help them be successful. Included in our client base you'll find investors, private companies, association.."
ELearning Solution - Providing All Elearning Need for any Institute,website,ehtishamsiddiqui,"Developing e-learning is more expensive than preparing classroom materials and training the trainers, especially if multimedia or highly interactive methods are used. However, delivery costs for e-learning (including costs of web servers and technical support) are considerably lower than those for c.."
efeqti - To-do lists and task manager online EFEQTI,website,hgenvm,"To-do list and task manager online. Calendar organizer and task planner to-do list online, todo list, task planner online, task manager, task planner, projects planner, project manager, task manager online."
"My Dog Hut - this store is currently in highly popular niche, our predictions are $7500 - $12,500 a month in revenue.",website,mydoghut,My Dog Hut is your ultimate online resource for all the latest dog gadgets & accessories. We don’t only offer smarts; we also offer stylishness. Each and every one of the products that we offer bears the Y.
Boost - Boost is the only software in the world that allows you to create URLs the grab visitors email addresses from their social accounts with permissions.,website,hoanglo,"With Boost, you can create social signup URLs that allow your visitors to subscribe to your email list without having to type in their email addresses. Boost gets your visitors email addresses by asking for their permission to collect the information from their social accounts. Boost can even collec.."
Become A Nomad (includes email list of 2000 in the deal) - Online community to learn how to quit your job and live life on your own terms. Featured on Product Hunt.,website,eddy,"*FEATURED on Product Hunt, Beta List, Reddit, Indie Hackers, etc* Clean-design website for creating digital nomad community, and be able to make $2,000-$5,000+ a month through affiliate marketing, selling e-books, courses, etc about making money online/digital nomad lifestyle. Selling because of so.."
eCommerce - Profitable Online Store,website,1wayshop,"This is a brand new store and total revenue is almost US $7,000 in the past few months. The store also has over 4,000 Facebook likes and a big mailing list on it. The store has generated over $2,000."
"Spring - Low-Maintence, Startup Marketing website (Includes 1000 email list)",website,eddy,"Have helped raise 70K for crowdfunding campaigns! Spring is a website that specializes in growth-hacking and helping entrepreneurs, especially crowdfunding campaign owners, reach their goal and set growth plans to increase brand exposure. We have interviewed ""Shark Tank"" companies on our blog (attac.."
Online Service Booking System - Mechanics / Doctors... - Online Service Booking System - Mechanics / Doctors...,other,mbarkichadi,"Auto Connect is an online automotive repair service booking software designed for automotive technicians or Auto Mechanics, Auto Repair Chains and small, medium and large vehicle repair shops. The user-friendly designs of Auto Connect, the automotive repair scheduling software will make your busines.."
Diamond Finish Car Detailing - THE BEST SERVICE FOR YOUR CAR,website,diamondfinishcardetailing,"If you are currently driving a dirty car, it is time to do something about it. Contact Perth detailing specialist diamond finish car detailing today. We will thoroughly wash the car and make sure the paint is protected."
Honey Hints - Best Greetings Cards Provider,website,https://www.sideprojectors.com,"Honeyhints is a platform, which is specially designed to share your feelings with your loved ones. Especiallyy for the Honeyhints members, we provide a scheduler from where you can schedule the time and date along with greeting. We understand in today's hectic world it is hard to keep track of all t.."
TopResumesWriters - Top Resume Writing Services,website,topresumeswriters,Top Resumes Writers provides with the best writing services of 2018. Choose the best resume writing service here. Use the expertise of the website writers and choose the service that matches your needs best.
Reveal Coupon Code - Get Best Brands Offers Coupons,website,carolaverill,Reveal code is not only a famous place for getting coupons and promo codes but also you can find more deals with top store brands and stores. We are not very old in term of age but our customer satisfaction and positive feedback that we do further improvement on our website and make more users frien..
InstaTagz.com - Instagram Hashtag Search Engine,website,mbwebd,Instagram online hashtag search engine and viewer. Discover and explore new hashtags and view current hashtag feeds.
Bridging Aspirations - Tailored Ad's for E-commerce,website,bridgingaspirations,"In the competitive world of Online space for marketing, the domain www. bridgingaspirations. com functions as an effective easy to use connecting tool to deliver the accurate needs through online Ad's to its visitors."
WearTwoCamp - an Outdoor Apparel Brand,website,takethisout,"WearTwoCamp is an outdoor-inspired apparel brand. WearTwoCamp has been successful in the past few months, especially during the Black Friday weekend. Generating over $7,000 in profit."
FundingPath - Tech company valuations visualised,website,limehub,FundingPath is a database of private tech company funding and valuation data. The site visualizes how their funding rounds and valuations evolved over time.
Revealcode - Revealcode.com aims to be your ultimate savior.,website,edward kutcher,"Revealcode. com aims to be your ultimate savior to get discounts on your favorite stores, brands, and restaurants. There is no longer a need to surf the internet to find promotional discounts and coupons in your locality."
"LuxScent - fragrance dropshipping store 2 yr old - PREMIUM fragrance dropshipping store 2 yr old. 5,000 items, all set up, great domain name.",website,bulcart,"PREMIUM fragrance dropshipping store. 5,000+ items, all set up, great domain name Beginner friendly website - Ready to start making money immediately - Premium Domain name - Free Marketing Guide - Easy to manage - No Experience Needed - Hot Niche This is a perfect opportunity to own a powerful onl.."
Maverick Pack - Community curated gear for remote work & travel,website,1450ev,Product Hunt style website for the digital nomad niche. A community of digital nomads and remote workers sharing and discussing the best products for their lifestyle. Based on a targeted niche community on a popular and important topic to the community.
Lead Generation - 1000 Valid emails of Dentist in USA,other,sathishraja,"I'm Sathish Raja a full-time freelancer. I have a team of 5 Members aimed to provide quality services. I'm very professional and have 6 years valuable experience in the Lead Generation, MS Excel, MS Word, PDF to Excel, PDF to word, Data entry."
Barcode Scanner - Barcode Scanner,desktop app,suhruth,Barcode Scanner.
Sky Potential Technologies - Design your App from Sky Potential and let your brand flourish with success.,website,sky potential technologies,"Sky Potential is home to the smartest, detail-oriented mobile app developers who are known to rule the App Store and Google Play listings across various industries. Besides the routine iOS and Android apps, our development team also excels in projects involving cross-platform, native or hybrid apps .."
IOTable - Interactive Touch Table - My sale is include a website and a real demo unit,website,iotable,The website is introducing my product. The multi touch screen unit is an intractive table what you can see on the site. I want to sell my full project what is include my website and a demo unit.
Ticket Master - Ticket master is a full featured ticketing solution to easily and conveniently solve customers/clients issues in an organized manner,website,namo,"There is just no substitute for knowing your customers and the different issues they face while using your services or products. The right support tools make it easy. It’s frustrating to be on the receiving end of support when the tool or solution isn't adequate to describe your moods, emotions or i.."
ECOMGENE - A Shopify Development Agency,website,roymujka,ECOMGENE is a Shopfy Store Development Agency working with clients worldwide. On February I have made over $750 developming ecommerce stores for the clients. There is no coding needed to run the business.
Bettium - Analytical Blockchain Platform for P2P Smart Betting,other,maria,"Bettium is a global decentralized platform enabling users to bet on sporting events against each other, each using big data and established experts to improve forecasts and strategy. Traditional sites pit the bettor against a classical bookmaker, an entity disinterested in the player’s success. Bett.."
xiaomibestdeals - affiliates aliexpress website,website,hicham93,an affiliate website with domain and host with a pssive income due to installed aliplugin that can import product from aliexpress that generate an organic traffic with seo.
thecustompackagingboxes.com - Custom Packaging Boxes Printing Services wholesale,website,thecustompackagingboxes,"The Custom Packaging Boxes company delivers and creates quality packaging, along with quality offset printing, digital printing and design services to a wide range of customers. From the knowledge based on years of experience and services, we provide you outcome that you wish for your products. Our .."
Logo Experts - Professional Logo Design Company,website,logoexperts,"LogoExperts is a top notch logo designing service. We make your brand identity outshine with unique logo design services dubai UAE arena, aesthetically created to suit your needs! With our creative insights, you are bound to get traction. e in UAE providing quality logo designs since many years."
Playary - Watch Movies & TV Shows and listen your favorite songs online in your browser.,website,fatih,Watch video clips from youtube and listen music. Playary collects and organizes music videos from Youtube and serves with music player UI. Our song database is growing day by day.
Marketplace - General Marketplace Project all features included,website,wesparklesolutions,General E-commerce Project all features included and manageable from backoffice. you can turn it into any kind of industry marketplace by changing categories from backoffice. Email : wesparklesolutions@gmail.
Quickeats - Fast Food Ordering Made Easy,website,bonificial,"The system works like Foodpanda and Postmates, similar model in real sense. Its a food delivery app where customers place orders and agent delivers from the registered restaurants. Agents, customer and restaurants create accounts with different variables and have their accounts verified by email and.."
youtube videos downloader - Videos downloder from youtube,mobile app,shahid,Very Awesome mobile app easy to use. very easy download videos from youtube as well specifice videos download with providing URL.
LedgerLawFirm - he Ledger Law Firm is always there when you need them - making the most reliable legal professionals in California.,website,ledgerlawfirm,"The Ledger Law Firm won't cease and stop to discover new strategies and things to win your case, for they care about you. All your legal needs get attended because of the famous firm in town that will come to your rescue. You don't have to fight alone, allow them to help you since they are not just .."
Movers Development | Marketing and Web Development for Moving Companies - Movers Development- Taking care of your moving company marketing!,website,moversdevelopment,"Movers Development is the relatively young company. Nevertheless, we have done a hell of a job! For only 6 years of our existence, we have a strong base of clients conducting their moving company marketing. Our experts in search engine optimisation are proved to be the best available."
Makiwara.KickPower - Simulator for measuring the strength and speed of impact in martial arts,other,ilshat_khasanshin,"We developed impact simulators that measure force, impact speed and response, allowing you to exchange data with mobile devices. Now the athlete and amateur can see the results of their training, progress, use training techniques from the masters. How it works? The athlete strikes, the sensors insid.."
Fundraisa - A list of 6600 angel investors from 440 United States cities and 132 industries,website,vikalevchuk,"A list of 6600 angel investors from 440 United States cities and 132 industries. We collected all the data points a startup founder needs to start a fundraising process — names, locations, profiles, validated email addresses, industries, job titles, phones. The project was launched with «pay for dow.."
Rent & Review Hub - Your review helps somebody. Somebody's review helps you.,website,pikasino,"If you want to own the most modern website for registering and reviewing rent properties with location, I will sell to you and help you to fit your design needs, additional functionalities and FREE support for the first 3 months from launching. (the support includes bugs with current website's featu.."
"Everything4you - Online Perfume, Aftershave & Beauty Shop",website,everything4you,Are you looking for online cosmetic & beauty products  in the United Kingdom at affordable costs? We offer all types of beauty care products at the right price.
"UniColor - UniColor is an LED light bar aimed at YouTubers, Instagram users, photographers and any other content creators that want to achieve professional, colored lighting on a budget.",website,unicolor,"UniColor will begin raising funds on IndieGoGo on 6th of March. UniColor creates a dazzling array of colored lights that can be controlled and programmed to help light scenes in dramatic and striking ways. Despite its grass-roots origins, it comes with a range of accessories and impressive high-end .."
Tilly & Jasper Ltd,website,tillyandjasper,"Tilly & Jasper was founded on a core vision of creating and curating beautiful clothes that children would love to wear, that parents would love to buy and that do not compromise on any social or environmental aspects of their production. These are the guiding principles of Tilly & Jasper, and they .."
Nice Formular,other,webmstr2018,"Nice registrer formular for include in any website - developed and designed with JQuery, CSS3 - completely compatible with webkit ( chrome - opera ) and mozilla browsers I can customize it to any colors you want to get suitable with your website or wordpress."
Casino Reports Canada - Online Magazine Website - Online iGaming magazine for latest trends in the world of casino games.,website,garypowers,"Welcome to Casino Reports – the latest online magazine in Canada, which offers information about the latest updates and news in the gambling field. Apart from keeping you informed, we want to make sure you are perfectly aware of the rules of slots, roulettes, poker, blackjack and every game that the.."
AwesomeEditor,other,webmstr2018,"AwesomeEditor is a web editor for include in any website - developed and designed with JQuery, CSS3 - completely compatible with webkit ( chrome - opera ) and mozilla browsers It provide new Web Fonts and I can customize it to any colors you want to get suitable with your website or wordpress."
My fabulous closet - Website to sale,website,naltha,You can check the link : https://exchange. shopify. com/shops/dresses-wrq-1   GENERAL DESCRIPTION This is fully automated and configured dropshipping store with everything that dropshipping needs.
Cardsync - Card syncing plugin for Trello,website,fiatjaf,"There are two projects, actually,   One, at https://green. cardsync. xyz/, is a Trello bot that people can just add to their cards and they start syncing."
LedgerLawFirm - he Ledger Law Firm is always there when you need them - making the most reliable legal professionals in California.,website,ledgerlawfirm,"The Ledger Law Firm won't cease and stop to discover new strategies and things to win your case, for they care about you. All your legal needs get attended because of the famous firm in town that will come to your rescue. You don't have to fight alone, allow them to help you since they are not just .."
Movers Development | Marketing and Web Development for Moving Companies - Movers Development- Taking care of your moving company marketing!,website,moversdevelopment,"Movers Development is the relatively young company. Nevertheless, we have done a hell of a job! For only 6 years of our existence, we have a strong base of clients conducting their moving company marketing. Our experts in search engine optimisation are proved to be the best available."
Makiwara.KickPower - Simulator for measuring the strength and speed of impact in martial arts,other,ilshat_khasanshin,"We developed impact simulators that measure force, impact speed and response, allowing you to exchange data with mobile devices. Now the athlete and amateur can see the results of their training, progress, use training techniques from the masters. How it works? The athlete strikes, the sensors insid.."
Fundraisa - A list of 6600 angel investors from 440 United States cities and 132 industries,website,vikalevchuk,"A list of 6600 angel investors from 440 United States cities and 132 industries. We collected all the data points a startup founder needs to start a fundraising process — names, locations, profiles, validated email addresses, industries, job titles, phones. The project was launched with «pay for dow.."
Rent & Review Hub - Your review helps somebody. Somebody's review helps you.,website,pikasino,"If you want to own the most modern website for registering and reviewing rent properties with location, I will sell to you and help you to fit your design needs, additional functionalities and FREE support for the first 3 months from launching. (the support includes bugs with current website's featu.."
"Everything4you - Online Perfume, Aftershave & Beauty Shop",website,everything4you,Are you looking for online cosmetic & beauty products  in the United Kingdom at affordable costs? We offer all types of beauty care products at the right price.
"UniColor - UniColor is an LED light bar aimed at YouTubers, Instagram users, photographers and any other content creators that want to achieve professional, colored lighting on a budget.",website,unicolor,"UniColor will begin raising funds on IndieGoGo on 6th of March. UniColor creates a dazzling array of colored lights that can be controlled and programmed to help light scenes in dramatic and striking ways. Despite its grass-roots origins, it comes with a range of accessories and impressive high-end .."
Tilly & Jasper Ltd,website,tillyandjasper,"Tilly & Jasper was founded on a core vision of creating and curating beautiful clothes that children would love to wear, that parents would love to buy and that do not compromise on any social or environmental aspects of their production. These are the guiding principles of Tilly & Jasper, and they .."
Nice Formular,other,webmstr2018,"Nice registrer formular for include in any website - developed and designed with JQuery, CSS3 - completely compatible with webkit ( chrome - opera ) and mozilla browsers I can customize it to any colors you want to get suitable with your website or wordpress."
Casino Reports Canada - Online Magazine Website - Online iGaming magazine for latest trends in the world of casino games.,website,garypowers,"Welcome to Casino Reports – the latest online magazine in Canada, which offers information about the latest updates and news in the gambling field. Apart from keeping you informed, we want to make sure you are perfectly aware of the rules of slots, roulettes, poker, blackjack and every game that the.."
AwesomeEditor,other,webmstr2018,"AwesomeEditor is a web editor for include in any website - developed and designed with JQuery, CSS3 - completely compatible with webkit ( chrome - opera ) and mozilla browsers It provide new Web Fonts and I can customize it to any colors you want to get suitable with your website or wordpress."
My fabulous closet - Website to sale,website,naltha,You can check the link : https://exchange. shopify. com/shops/dresses-wrq-1   GENERAL DESCRIPTION This is fully automated and configured dropshipping store with everything that dropshipping needs.
Cardsync - Card syncing plugin for Trello,website,fiatjaf,"There are two projects, actually,   One, at https://green. cardsync. xyz/, is a Trello bot that people can just add to their cards and they start syncing."
Interview Tool - Place a candidate in work place. Helps recruiting process easy,website,krishnareddy,"Interface between candidate and client (end customer, recruiting agency or 3rd party consultancy) Provides details Job description Provides details about Company Send notitications to candidate to remind the interview schedule Keep sending reminders Provides basic interview questions and soft s.."
Learn to Trade - You can finally achieve financial freedom.,website,tamsencartwright,"Learn to Trade’s Training Centres and Trading Floors around the world focus on quality education, giving our students an opportunity to learn from experienced professional traders."
SwipeStudio - Earn money by selling Snapchat Geofilter designs on our platform,website,hello@swipestudio.co,"Become an artist on SwipeStudio Upload your Snapchat geofilter templates and get paid every time somebody buys it. Earn royalties for every sale Any time your templates are sold, you’ll earn a generous royalty. With SwipeStudio, users pay as soon as their design is ready and you get your cut insta.."
EduHappy School Management Platform - EduHappy is school management platform SaaS on the cloud,website,helmahdy,"EduHappy is a School ERP and LMS, which is designed specifically for Education and allows you to manage your school or group of schools from one central place. EduHappy is a School Management Platform which integrates three systems in one solution; School Management System, Student Information Syste.."
SendCatch - SendCatch is the easy way to transfer files between anything with just a bump.,website,masudm,SendCatch is the revolutionary way to transfer files between anything with a web browser and an internet connection. Check the site out and try it out!.
according to local sources... - A news aggregation service using AI to find local reporting on current global breaking news,website,d2erima,"I'm working on a news aggregation service with a twist. It's called ""according to local sources. "", and the basic idea is that local news media are often quicker and more knowledgeable than global news agencies when reporting on major international breaking news."
cryptototem.com - Best Ways To Invest In ICO’s ( ICO rating),website,rittu,ico list Large and engaging database data. The database contains companies with ICO ratings. The system automatically considers the reliability rating of the company.
custom thesis,other,mickdown,"Having tackled the issue with writing and gather vital information, the contender for a degree settles down to composing the paper itself. Subsequent to setting up a thesis for an examination paper and getting it affirmed by the educator, one can continue to compose some other segment of the paper. .."
BenchBug - A mobile app social platform for health & fitness enthusiasts,mobile app,opfred,"BenchBug is an iOS app that enables users to discover trending topics on health & fitness, create and share posts, and interact and connect with like-minded users. This app ( fully functional ) was created with the intention of becoming a full-on business, but fell short of marketing. I finished wri.."
GPA Calculator - The easiest way to calculate GPA and class grades,website,wasai,"GPA calculator is free online tool that makes calculating your GPA easy, simple and maybe even fun 😉. Quickly calculate your high school, college or cumulative GPA, check class grades and figure out what you'll need on the final to get that A. Extra credit: learn how to convert letter grades to gra.."
blog with cms for bloggers - Blog with cms,website,saif786,responsive in design dynamic content management system. seo friendly slider browse by categories comment system admin and author system. views reoprt.
"mylastrequest.biz - Express your last requests and record, alter or update them free 24/7",mobile app,tom,A platform for users to express their last requests and wishes through a downloadable app. i. o.
officechairhub - Office chairs,website,r806gisela,"All around furniture store for sale, categorized by rooms in the home, suppliers approved, thousands of products uploaded with SEO and custom image sizes and names. Lots of custom coding for urgency, trust and scarcity. Great suppliers, easy to work with, quick shipping, only had one product issue e.."
