Longboard-tv - Longboard Kit and Tip Website,website,longboardtv,Longboard-tv. com is a Longboard Kit and Tip web site that emphasizes essential comments and guides every month. Our experts deliver products or services evaluations built upon authority assessments consisting of customer opinions.
Alfred Black - Climbing Kit and Advice Site,website,theclimbingpros,Theclimbingpros. com is a Climbing Gear and Tutorial website that contains worthwhile consumer reviews and reports every month. We present product reviews accordinged to authority point of views utilizing consumer comments.
Aktu - All your news in one place. News Aggregator + RSS Reader,website,guybedo,"Aktu is a  news aggreagtor/rss reader web/mobile app, it aggregates news items from thousands of sources, Google News style, so you can have easy access to the top stories. You can add your own feeds, items will be automatically categorized and aggregated. Main features: news aggregation into top st.."
Climbing Chief - Climbing Kit and Guide website,other,climbingchief,Climbingchief. com is a Climbing Equipment and Tip web site which provides useful honest reviews and information each month. Our experts provide product assessments based on professional thoughts including shopper opinions.
Panadigm - Industrial & Innovative Equipment and Advice Online Resource,website,panadigm,www. panadigm. com is an Industrial & Innovative Equipment and Tip online resource which emphasizes beneficial write-ups and editorials monthly.
Apply Indian Visa Online - We Help You To Apply for Indian Visa Online,website,applyindianvsa,We provide India Visa application services for United States natives and world-wide traveller that choose to see India. We aid you apply for eTV together with India Visa along with guide you through the process.
"Roulette Vision - Online magazine for roulette games, strategies, tips and tricks",website,joshuarowley,"I am an in-house project manager in the iGaming area of business. Throughout the years, I’ve learned that online gaming is mostly an interesting field. In this project we have created online magazine for roulette games, strategies, systems and reviews."
NexThemes - NexThemes a Premium WordPress and HTML Club,website,nexthemes,"NexThemes offers Premium HTML and WordPress themes, a lot of web services and maintenance."
"Crypteye - Statistics for e-currencies, logs && account handler",mobile app,w0dm4n,"Crypteye is a mobile application that giving infos on best e-currency of the moment, with graphics, connection through a personnal account to set your own currency. You can choose USD, EUR ect, to show prices. This project is done in 3 part, The mobile application which has been developped in Ionic .."
"Oh, My Coins! - Database of lost cryptos - 3 weeks old, >5200 unique users/month, 25% returning visitors",website,mlejva,"""Oh, My Coins!"" is a website where people can anonymously share their cryptocurrency loss. So far people have submitted loss worth about 250k BTC or $4. 5B."
Netpeak Checker - Netpeak Checker is a multifunctional desktop tool for bulk URL analysis and comparison of websites based on a wide range of parameters.,desktop app,valerie,"Netpeak Checker is a multifunctional research tool for bulk SEO analysis that helps you audit URLs by a wide range of parameters. This tool allows you to: Check 1,200+ parameters of URLs Research backlink profile of the websites Evaluate your competitors Compare URLs by parameter.."
AzaleaPark Shop - Home Furniture Store,website,mohamedhadi ferjani,"hi , i created this store a month ago and i runoutof money and i couldn't find any to start an ad."
Captain Climber - Climbing Equipment and Quick Guide,website,captainclimber,Captain Climber is a Climbing Equipment and Advice site that includes valuable comments and short articles every month. Our experts introduce product or service evaluations built on authority viewpoints including things like customer information. Our assessments are also based on our enthusiasm for ..
Skylark - Geofencing app for smart thermostats,mobile app,primeintellect,"The App: Skylark for Nest & Honeywell Thermostats http://www. skylarkios. com/ Skylark automatically & reliably controls Nest/Honeywell thermostats and smart devices, based on your location."
Human Resource Management System - Human Resource Management System,other,mbarkichadi,Human Resource Management System Key Features: Mobile compatible. Multi language support. Admin and Employee panel.
Apagraph - Create and share beautiful quotes with themes,website,gvidon,Apagraph is the new way to create and share quotes. We have more than 30 themes and are constantly adding more. Sharing is as seamless as possible.
Multimeters For Sale - Top Multimeters for Sale Reviews and Tips,website,multimeter4sale,Multimetersforsale. com is a Multimeter Equipment and Resource site that offers essential reviews and articles on a monthly basis. We deliver goods overviews founded on professional thoughts utilizing customer responses.
Camping Gravieres - Camping Kit and Overview Online Resource,website,campinggravieres,"Camping Gravieres is a Camping Gear and Tip website which contains invaluable write-ups and short articles monthly. Our team showcase product line overviews formed on professional viewpoints utilizing purchaser reviews. Our customer reviews are also founded on our passion for it, always keeping you .."
MULTI POS – RESTAURANT POINT OF SALE WEB APPLICATION MULTIPLE STORES - MULTI POS – RESTAURANT POINT OF SALE WEB APPLICATION MULTIPLE STORES,other,mbarkichadi,"is an online restaurant Point of Sale app has a user friendly interface that everyone can use without difficulty. The POS can be used online, on iPads, Android tablets or laptops Say goodbye to ugly, expensive, outdated POS systems and enjoy the POS web interface designed for the modern retailer."
AeroData.in - Get Valid Up to Date B2B Data,website,neal,"AeroData. in is a b2b email and business repository. AeroData crawls the web to build such emails lists using various APIs, cleans the data and put them in a nice format to be used for email marketing or for market research."
ERP System - ERP SYSTEM,desktop app,minhajhussain1993,ERP SYSTEM TECHNOLOGY USED: ASP. NET MVC HTML/CSS (BOOTSTRAP) JQUERY C# MODULES: EMPLOYEE MANAGEMENT CUSTOMER ORDER MANAGEMENT LEDGER MANAGEMENT SUPPLIER MANAGEMENT PAYROLL MANAGEMENT SALE ORDER MANAGEMENT PURCHASE ORDER MANAGEMENT.
Shift planning mobile app/web app - This is a shift scheduling app using chatbot asking you employees when they would like to work. Then you can plan the shifts and inform the employees via the messenger chatbot,mobile app,ziggasg,This is a shift scheduling app using chatbot asking you employees when they would like to work. Then you can plan the shifts and inform the employees via the messenger chatbot.
Camping Virgen Mar - Camping Equipment and Overview Website,website,campingvirgenmar,www. campingvirgenmar. com is a Camping Equipment and Guide online resource that provides very useful overviews and articles monthly.
Rahul Kumar - Free Resource Centre,website,zigyasu,"Zigya derived from the Sanskrit word ‘Jigyasa’, meaning 'curiosity' forms the ethos of the company. Curiosity is the foundation of learning, which is why Zigya follows a unique model of non-pedagogical approach to learning. Zigya comes with an objective of providing a Resource Centre for all to tap .."
Hotel ERP System v5.7 - Hotel Management Program,desktop app,theghost,Master Entries :   Hotel Master Hotel Plan Master Currency Master ID Type Guest Room Type Room Master Extra Bed Extra Person Banquet Hall Master Garden Master Food Category Table Master Food Master Liquor Category Liquor Quantity Liquor Master Liquor Pricing ..
Cruzata Full CRM - All-in-One CRM Solution for your custom needs,website,cruzata,This is a one-stop CRM solution for your custom needs to help manage business and customers in a more efficient and productive manner. It consists of Major Modules such as:  1. Lead Management  2.
organic foods for all - im doing this project for the purpose to eliminate the poison foods in market,other,nellara,nowadays everyone are busy to make money. many of them doesnt have enough time to bake foods for their daily life. so everyone go to the restaurents to have foods.
"Mobile app which shows latest news feeds, trending videos on youtube and trending tweets. - Mobile app which shows latest news feeds, trending videos on youtube and trending tweets.",mobile app,hirak,"This project is an android application which shows the user the latest news happening around him, what is trending on twitter and trending videos on youtube. User can also post tweets, like tweets, share the news feeds with others via whatsapp or post it on facebook can watch trending videos on yout.."
Masterpiece Roofing - Roofing Expert,website,masterpieceroofing,"A roofing contractor that delivers high-quality services. They have been in the industry of home improvement for 20 years, and have gained high ratings. With customer service available 24/7, clients are confident that their concerns will be taken care of in the possible time."
Frank Robbins - Top IT Products Reviews and Tutorials | rv8tors,website,rv8tors,Rv8tors. com is a IT Gear and Resource online resource which contains helpful comments and articles on a monthly basis. Our experts provide product critiques founded on professional assessments utilizing purchaser opinions.
QR Drive Club - Social Media for Car Enthusiasts,mobile app,bryjoaq,"This project is live on both the App Store and Google Play Store. QR Drive Club is here to connect the car enthusiast community! It is a social platform that allows users to share their car related content with the community! Share your builds, upgrades, and modifications made to your sweet ride! F.."
Aboub B2B Marketplace - Finest Business to Business Portal available online,website,aboub,"Aboub is the best & most reliable online business to business portal to connect with international manufacturers, suppliers, exporters, wholesalers and retailers. Aboub is the best & most reliable online business to business portal to connect with international manufacturers, suppliers, exporters, w.."
Unlideals - online booking,other,unlideals,"Book your travels online for a hassle-free vacation. Everything is made easy when you do your transaction over the internet. Online stores offer great tour packages for you to enjoy, whether you are going in a group or alone."
alby - website design,website,expressure,We are working on the website design and development of a seven-star hotel in Kerala. It is an immense pleasure on our part to be working for them. They were checking out for the best web design company in Kerala and found us.
interior design - designing the interior of an office space,other,royalcasa,We are working on designing the interiors of a high-class office for a very reputed company in India. We are coordinating with the interior designers Alleppey for this very substantial project which we are highly looking forward to. Interior designing is a creative art.
REALKART - E-Commerce marketplace website for sale,website,realkartonlineservices@gmail.com,The ecommerce market place website developned in Magento platform ready to operate is for sell. Also some sellers already joined. Those who will buy can on the time sell their products online & can join other sellers also to sell their products on the site all over india.
Shiftybitscult - Cooking Equipment and Advice Online,other,shiftybitscult,Shiftybitscult. com is a Cooking Kit and Tip online resource which features important critiques and guides on a monthly basis. We showcase product or service overviews accordinged to authority viewpoints utilizing buyer opinions.
Country Quiz - Addictive online quiz game,website,markpedersen,"Simple webapp built entirely with PHP and HTML, using Pixabay's API to pull images and quiz users about them. Within 1 week after launch more than 5k visitors came from YouTube after being featured on a few different channels. Now there's around 30 active users daily, with an average of 10 page view.."
eTeki - eTeki - Technical Screening/Talent Assessment,website,eteki,"Conducting employee interviews for tech jobs can be a huge challenge. You need to know that the applicant you’re hiring has the necessary experience and skills, and online tests are not always reliable indicators of success. eTeki’s technical interviews-as-a-service platform is designed to help hiri.."
Christmas Co. - Shopify Store for all Things Christmas!,website,neviar,Christmas Co. is a drop shipping store with all things Christmas! Help your customers get ready for the holiday season with this store. Fully automated with drop shipping.
Methods to delete yahoo account,website,adeleaastha,There is only a single method by which you can delete your Yahoo mail account; that’s raising a request for deletion of your account. This is really important to understand that deletion of a Yahoo account will take a minimum 40 days to get it done; still it varies with the different geographic loca..
Noplag Company - Best Online Plagiarism Checker!,website,manager noplag,"Noplag. com - is leading originality-checking service, which helps to detect plagiarism and avoid unintentional plagiarism in your writing."
Chilean electronic invoice system (connected to local IRS) - Chilean legalized electronic invoice system (GUI + API),other,variacode,"Our DTE (Electronic Tributary Document) generation system was designed for those who wish to provide for their clients a platform in which to create this kind of documents, bookkeepers with large portfolios or any kind of business that wishes to enter the invoicing market in Chile FacturaPlus is cur.."
MZ Store - This is an Ecommerce Webiste.,website,moiz,Hello Guyz! This is an E-commerce Website. It is very helpful to you for your online business and projects.
Moon Wallpaper made in Adobe Illustrator - Moon and wolves Wallpaper made in Adobe Illustrator,desktop app,bogdans1,Moon and wolves Wallpaper made in Adobe Illustrator. Customizable. SVG document.
GramVideos.com - Instagram Video Search Engine,website,mbwebd,Search and view full size Instagram videos from any non-private instagram user.
Passat B6 Illustration - Passat B6 Illustration made in Adobe Illustrator,desktop app,bogdans1,Passat B6 Illustration made in Adobe Illustrator. SVG document. Customizable.
Illustration of Golf 6 R - Illustration of Golf 6 R made using Adobe Illustrator,desktop app,bogdans1,Illustration of Golf 6 R made using Adobe Illustrator. SVG document available. Customizable.
"Futoshiki & Futoshiki Pro - The first result in Google Play search for ""Futoshiki"". A type of puzzle game similar to Sudoku.",mobile app,dambus,"Futoshiki is a type of puzzle game similar to Sudoku that is very popular in Japan, the UK and other countries. My app, simply titled Futoshiki, has held the number 1 spot on a Google Play search for Futoshiki for several years. It has over 35,000 installs."
WebsiteAnalyzerTool.com - Website Analyzer Report Tool,website,mbwebd,Analyze any webpage. Generate a website analysis report to evaluate SEO ranking factors and more for any webpage.
CuratedTube - Watch and browse hand-curated YouTube playlists through a TV-guide interface,website,dambus,"CuratedTube aims to harness user-curated playlists of Youtube content, displaying them in a familiar TV-guide interface. Users can submit their own playlists as ""TV channels"" and can vote channels up or down so that the best channels are displayed first. CuratedTube is built on Bubble."
"Infrared Building Inspection Software - Mobile and desktop web app for sub-niche of the building inspection industry, Infrared Inspectors.",other,memedia,"ScreenIR helps Infrared Inspectors follow standardized inspections for various Infrared Inspection Types (Moisture, Energy Loss, Mechanical, Electrical and Roof). It provides a drag and drop inferface for repositioning all rooms and inspection points within each room as the inspector moves through i.."
DCI mailsolutions - Newsletter & Mailing System with Analytics + GEO location - DCI mailsolutions - Newsletter & Mailing System with Analytics + GEO location,other,mbarkichadi,Mailing system to organize marketing campaigns and sending newsletters. Program tested on PHP 7 and optimalized using 500. 000 emails databse (min.
Online Learning & Examination System ready to use - Online Learning & Examination System,other,mbarkichadi,"Excellent for universities, colleges, schools, training institutes, organizations and recruitment agencies to conduct online exams. It also supports YouTube videos, and images to create questions for online exams. Built with Laravel, the most powerful PHP framework makes people to customize  system .."
"PeopleMaven - PeopleMaven is a new social network that helps people discover, save, and share the world’s most amazing people.",website,peoplemaven,"PeopleMaven is the answer to a common problem that we all have faced. How do you find top talent quickly when you need it most? We want to be the place where people go to find and save interesting professionals and experts. We realized that as people zig zag around the Web, they constantly stumble a.."
"Massive ad network directory with Full contact details, company details, publisher and advertiser details - IF you are selling to adTech industry, this database is all you need ever.",other,_aarjay_,"A single point of information for everything adTech. You can get the following data of every active publisher, advertiser and advertising exchange. i."
Springella - Springella is a Facebook-based gifting application that allows people to pick the gift and then share it on a user`s timeline,other,raulrassa,"Springella is an Facebook based aplication, what can be used to share digital or actual gifts/item between FB users. Click & Collect solution, special module for businesses/traders. Can be devoleped as social-media marketplace."
Workroll - A freelance jobs aggregator,website,workroll,"Workroll. com is an early stage start-up, building a jobs platform for high-end freelancers. We index 300+ online sources that provide freelancers with 5-10 new, high value leads every day, saving them up to 20+ hours per month when compared to doing it by hand."
"Surge Fitness - Located in the Perth CBD, this Surge Fitness Club is perfectly positioned for those city workers who want to maintain a healthy work-life balance.",website,surgefitness,Achieving a desired level of fitness is a unique experience for each person. At Surge Fitness this experience will be a positive one that occurs in a safe and professional environment. Surge Fitness is equipped with the personnel and facilities to help you reach your individual health and fitness go..
Task Vision - Task Management Easy Tool / Web Application,website,harshtechnology,"TaskVision for small businesses to take control of their time, tasks, and projects. One page task management tool not complicated as others. Easy to assign task and monitor task status and working performance."
PokerPad - Play Texas Hold’em Poker with up to 4 players using just one iPad.,mobile app,jorgehurtadof,FOUR PLAYERS. ONE IPAD. Play Texas Hold’em Poker with up to 4 players using just one iPad.
Kinetic Mall - Kinetic Mall is a unique Web2Print e-commerce!,website,kinetic trade,"KineticMall is not like any other web2print ecommerce that you might have seen around. In its core you will find that it’s very innovative and in same time extremely simple. It took us two years to build the site with many professionals involved, which have spent thousands of hours to it."
Polished Off - POLISHED CONCRETE PERTH TO DUNSBOROUGH,website,polishedoff,Polished Off Concrete services all of the Perth metro and the southwest region. They extensive inventory of polished concrete in a host of finishes and cuts. They have successfully installed custom flooring in the homes and structures of property owners all over Perth.
Time Tracking With Screenshots - Time Tracking,website,stefankozarov,"SCREENish time tracker with screenshots runs as software on your desktop or as a mobile app making it easy to track time, screenshots, activity levels, programs used even more. SCREENish time tracking with screenshots provides large and small business teams with organized time sheets, attendance tra.."
Excellent landing page - universal and customising,website,liho26,"Simple landing page with feedback form based on Python, Flask and JQuery. Very quick page loading into browsers. SEO friendly."
Tik Tak! - The Yak is back (with some content curation)!,mobile app,tiktakapp,"Tik Tak! was born out of the desire to bring back a platform that many loved & miss, but with some minor adjustments in content curation in order to ensure a healthy anonymous community for all. Tik Tak! users can post anonymous 140 character messages which are shown to users within a 3 mile radius..."
License rights to SiteLauncher code. SiteLauncher is a speed dial extension for Google Chrome. - Surf faster and with more style.,desktop app,donesmart,SiteLauncher is a unique and popular speed dial extension for Google Chrome. Try SiteLauncher at https://chrome. google.
Justin Ray - Hunting Kit and Resource site,other,thehuntersbag,Thehuntersbag. com is a Hunting Equipment and Advice online resource that showcases essential overviews and short articles every month. Our experts introduce products or services overviews formed on expert judgements incorporating buyer information.
CallBackCatcher - The instant callback system through the user-friendly widget on your website directly to your customer.,website,callbackcatcher,"CallBackCatcher offers instant callback system through the user-friendly and easy to access widget on your website directly to your customer. Our primary strategy is to increase your company's customer satisfaction through our system, as it is the most convenient and cost- effective callback alterna.."
Mobile Electronic shop - You can sell any type of physical products online.,website,aasman100,"This is a complete ecommerce project to sell any type of physical items online. It has used php 5. 5, php 5."
"Bootstrap Directory CMS Script (Doctors,Mechanic,Teachers...)",other,mbarkichadi,"Bootstrap Directory CMS Script (Doctors,Mechanic,Teachers. ) It is a complete solution for searching doctors,Mechanic,Teachers. according to location and category."
Justin Ray - Hunting Kit and Resource site,website,thehuntersbag,Thehuntersbag. com is a Hunting Equipment and Advice online resource that showcases essential overviews and short articles every month. Our experts introduce products or services overviews formed on expert judgements incorporating buyer information.
"e-Commerce for Hair Products (High gross rate!) - ""Buy high selling hair loss products in a few clicks, at the lowest prices""",website,italocalvino,We are leading suppliers of HAIR LOSS products in the USA and Europe. Monthly cost: £20-30 (Shopify membership) Marketing costs: £0 SEO: £0 Other costs: £0   The website is ranked on the 1st page of Google. co.
Datastarta - A database of 3150 angel investors to get seed funding for your startup,website,lunilevskyi,"A SaaS-service with an access to a database of 3150 angel investors with names and profiles, investment score, location, investment criteria. There is also a Telegram/Messenger bot for users to access the data."
"iluvit.club - social website - Search, Share & Discover the things you Luv!",website,club786,"The iluvit. club is a social website that lists the local businesses such as Restaurants, Hotels, Coffee places, Pizza places, Bars, Fitness Centers, Beauty Salons etc. in the United States."
Picky My Speakers - Speaker Kit and Resource Website,website,pickymyspeakers,Pickymyspeakers. com is a Speaker Kit and Resource website that showcases valuable overviews and reports monthly. Our experts showcase goods critiques accordinged to specialist opinions including things like customer responses.
LearnSwift.tips - #1 Google Result for 'Learn Swift' Since 2014 - Higher than Apple's Own Results,website,ziggymo,LearnSwift. tips is a simple site to get started learning Apple's new programming language for iOS - Swift. It's been the #1 result on Google for 'Learn Swift' since Swift launched.
Menutab - Publish and promote your restaurant's menu on Facebook and accept online orders.,website,sebastian,"24,000 Restaurants Over 24,000 Restaurants are already using Menutab to publish and promote their menus. Add Menutab to your Facebook Page and see why. Greater Freedom No obligations."
GraphicDesignmY - Web graphics Designing Service Website Like envato,website,akansha,A complete Graphic Designing service website where you can get the order and directly get paid through your site. We Offers  following service through our website: SERVICES: ONLINE MARKETING 1. Infographics 2.
Lykup Social Network - A social Utility that connects people.,website,torrahclef,"Lykup makes it easy to meet and socialize with new people through games, shared interests, friend suggestions, browsing profiles, and much more. Please create an account to see everything about lykup. Here is my Whatsapp: +234-8138-652645 I am currently in Nigeria, but will travel other country soo.."
Beer Store Dashboard - Find a random beer from a real brewery beer store.,website,spleedo,"Find a random beer from a real brewery beer store. This dashboard allows you navigate via seamless UI transitions depending on your specified beer search criteria. It allows you to find beer types such as IPAs, craft beer, stout with categories such as North American Largers, German Origin Ales etc..."
