ini - List Maker with Notes - Organize shopping and recipes,mobile app,artem,"I Need It ""ini"" stands for ""I Need It"" and sounds like 3 first letters in ""initiative"" word. It is an application that makes family shopping easier. With sharing and synchronization features users can easily manage lists from home while their spouses are doing shopping."
PHP projects to sell - 10 complete PHP projects to sell,other,prithviraj007,"Hi, I want to give my 10 working PHP projects which I made in last few years of my college, this projects include complete package of project Websites for php with source code 1) Voting System 2)Assignment management 3)event management 4) Job-scope 5)Project management 6)Student support system 7)onl.."
Synthia Billing & Ticketing - Highly Extendable Web Based Ticket & Billing System,website,grizzlysts,"Synthia started out with the goal of being a lightweight PHP & MySQL based billing & ticketing system. Right now, it supports ticketing & downloadable products, without true billing functionality. The video below is a demo of the product."
Experimental zenmate & tunnelbear like chrome extension - non-invasive / high performance web tunneling platform,website,psychip,this browser extension allows you to browse blocked websites on your grounds such as corporate firewall or government restrictions. started as a side project and become a full-time work. it can be the next zenmate if marketed properly.
Accountability Buddy - Accountability Buddy aims to help you achieve your goals and dreams.,mobile app,edison,Accountability Buddy is aimed at helping people S. M. A.
Full ERP - Business Resource Planning Management - Full ERP - Business Resource Planning Management,other,mbarkichadi,"Full ERP is a Modern and Responsive Business management system. It is developed by PHP and Laravel framework. It is designed and develops for small & Big Business, shop, company and any types of business."
Catalog Lifecycle Management (CLM) - Enterprise Software - Master Data Management (MDM) Software for Enterprises,other,proxyprodigy,"MAKE AN OFFER! I know this description is long, but this is a major project that requires a lot of explanation. After reading the description thoroughly, feel free to contact me with any additional questions - seriously interested parties only, please. What is the problem? As companies grow, so do.."
Action Hound - Match-making mobile app for people looking for a challenge,mobile app,proxyprodigy,NOTICE: PRICE DROP!! Action Hound is a mobile (Android and iOS supported) app that allows players to connect with other local players in the location of their choosing. Simply select the game(s) you are interested in playing (i. e.
Netent Starburstslot - Extremely simple slot machine,website,annamccarthy,"Netent Starburstslot is a online gambling website, where you can find many interesting slots for your own taste. We offer many games to make online money or just spend your free time. Our best slots are always available to play online with the best offers and bonuses from us."
Faceout - Faceout - emoji privacy camera,mobile app,faceout,Camera app that use advanced iOS11 tech to mask all recognised faces through emotional facepacks realtime while location of photo is unknown too. Pure Anonymous Camera.
Crypto Tourism - Its a MLM site with full functionality to introduce your own coin for tourism industry.,website,shahidsaroya,This website is designed to be used as Multi Level Marketing (MLM) plateform. On this website Direct refferal gets 5% deposit bonus and Binary is settled to 10% fixed if it meets the 2:1 or 1:2 rules. ROI is from 1% to 2% depending on investment plan a user chosed.
BET7 - Its a Betting App for cricket Bookies,mobile app,shahidsaroya,Its Ready to operate Android Mobile application for you. Please download from the link and install. Key Features: 1 User Registration 2 User Login 3 Deposit via Bitcoin 4 ROI 0.
BET7 - Its a Betting App for cricket Bookies,mobile app,shahidsaroya,Its Ready to operate Android Mobile application for you. Please download from the link and install. Key Features: 1 User Registration 2 User Login 3 Deposit via Bitcoin 4 ROI 0.
"The Autonomous Data Engine - Using a code-free environment, Infoworks allows organizations to quickly create and manage data use cases from source to consumption.",desktop app,infoworksio,"Infoworks eliminates big data complexity by automating data engineering through the company’s Autonomous Data Engine, which has been adopted by some of the largest enterprises in the world. Using a code-free environment, Infoworks allows organizations to quickly create and manage data use cases from.."
"SmartPhone Game Simulator - Play Windows games like Asphalt8, GTA San Andreas, NFS MMW etc using your SmartPhone as Gesture Control.",desktop app,vslcreations,Enhancing Gaming Experience SmartPhone Game Simulator relies on existing smartphone IMU(Accelerometer+Gyroscope) sensor data to simulate Windows games. Download IMU+GPS Stream Android App https://play. google.
Newsbelow websites - 9 domains! - Fully automatic news aggregator. Own design.,website,newsbelow,"Hello, It is a fully automated news aggregator from the most widely read media across Europe. For sale is a project that offers not only one thing but ten domains with tens of thousands of indexed pages. This was launched from November 2016."
BLUELIX - Customized Dropshipping General Store for Sale - 201 products - Extraordinary Collections of Winner Products! Months of research and hard work in it! A general online store with valuable merchandise and fully automated.,website,miruna,"Bluelix store collections are chic shopping deals on: - baby clothing,  - baby shoes,  - baby accessories, - baby care, - women fashion - men  - cool gadgets - jewelry Beautiful Responsive Paid Theme included - Retina 3. 2 - 180$ price  included in sale. Classy customized Logo & Design made by p.."
"ERBAĞ YAPI MALZEMELERİ - Erbağ Yapı Malzemeleri - Mantolama, EPS, XPS, Taşyünü Fiyatları",website,erbagyapi,1994 yılında ERBAĞ İNŞAAT Ankara merkezli olarak  kurulmuş olup yılların deneyimi ile inşaat sektöründe uygulama anlamında  birçok projeye başarıyla imzasını atmış ve atmaya devam etmektedir. 1994 yılından günümüze kadar Ankara’da ve Bolu’da yaklaşık 500 konut sahipleriyle buluşturulmuştur. 2013 yıl..
Browmine - Funky T-shirt Store,website,shopify.mail1997@gmail.com,The best and unique design for your t-shirt. The t-shirt store.
Get a Jab - Get a jab is a job posting/classified site that enables job seekers to neatly pursue job applications in an easy manner,website,namo,"Get a jab is a startup/web application coded in php and mysqli (for sequrity). It compasses of a job classified module,  (where admins can neatly post job applications in a stastical manner), members module, (where members can register, subscribe to a job vacancy category and be receiving email noti.."
Light Studio - Let's put your business under the spotlights !,website,lightstudio,"Light studio is a Digital Marketing and web design agency in Montreal. We provide an all-in-one digital marketing solution for our clients and offer a large panel of services like web & graphic design, SEO, Photographie, business management coaching and many more. Our marketing experts can help you .."
Ladies & Gentlemen online dating platform - Properous online dating platform,other,rollandady,"Back to 'hungarian dating' Listing ID: 2420157 Hungarian Dating Platform With Profit For Sale Budapest Asking Price: $70,000 (USD) Sales Revenue: Under $100K (USD) Cash Flow: Under $50K (USD) Hungary has a huge market for online dating and it keeps growing. We are selling a registere.."
MedManage - Log and manage your medications,mobile app,medmanage,"MedManage is a medication history, and calendar log that reminds you to take your medications and track your progress, especially useful for people taking multiple medicines and their family caregivers."
WearTwoCamp - An outdoor inspired apparel brand,website,takethisout,"WearTwoCamp is an outdoor-inspired apparel brand. WearTwoCamp has been successful in the past few months, especially during the Black Friday weekend. Generating over $7,000 in profit."
Football Results & Sports News Website - A sports content and news website that shows the latest football results.,website,karimmuhtar,A football (soccer) and sports news or content website that shows the results of the latest games. Can tweaked and be used for Fifa World Cup 2018. Results of other leagues and countries can be added.
1AIO - ALL IN ONE CRYPTO RELATED - 1AiO cryptocurrency related links and guides,website,imad07mos,website : 1aio. com domain + server (vps) twitter : @1aioCom telegram channel : @AirdropStream website not monetized  yet  reason : got full time job.
YELLOW WILLOW YOGA - LUXE HIGH PERFORMING YOGA MATS+ AN EXTRA LAYER OF GRIP,website,yellowwillowyoga,"Our yoga mat and yoga towel range is inspired by our love of design, movement and fashion, YELLOW WILLOW YOGA was created to bring beauty and performance to the yoga experience. We embody a belief that confidence, beauty and awareness are the cornerstones of physical experience, and our designs and .."
Shopboostr UG - Shopboostr ist eine Full-Service E-Commerce Agentur,website,kryptovergleich,"Shopboostr ist eine Full-Service E-Commerce Agentur aus Berlin & München spezialisiert auf das digitale Umfeld. Wir verhelfen Unternehmen bei der Entwicklung innovativer E-Commerce Onlineshops, Marktplätze sowie Online Plattformen. Wir verhelfen unseren Kunden bei jedem Schritt ihres Projektablaufes.."
UI Grid - Bootstrap Themes & Templates,website,vinayak5192,Im the original owner of the site. www. UiGrid.
"Your Fitness Application - Mobile application to manage Exercise, Gym, Plans, Reminder, BMI and Reporting",mobile app,business_developershive,"Your Fitness Application is an Android application that allows you to manage your Gym, Excercise, Plans, BMI, Reports, Find Nearby Gyms on Map and more. This is a complete application with Source Code. Contact us if you are interested in buying the source code."
DriveMyDev - Customer feedback the other way,website,drmauij,The problem: as developers/product managers we all have limited resources (money/time) on product development and we don't really know which feature we should implement next to meet the needs of our users/customers. Thus we oft end to implement something we think it's important but no one really nee..
Requisitos para - Todos los requisitos que tienes que cumplir para cualquier tema,website,requisitospara,"En esta web encontraras la ayuda necesaria para saber que requesitos tienes que cumplir en cientos de situaciones diferentes, saber que tipo de tramites tienes que realizar o que papeleo tienes que rellenar. Te enseñaremos de saber que requisitos tienes que cumplir para ser bombero hasta que requisi.."
Krypto Vergleich - Krypto Vergleich ist eine Full-Service Blockchain & ICO Agentur aus Berlin & München spezialisiert auf das digitale Umfeld.,website,kryptovergleich,Krypto Vergleich ist eine Full-Service Blockchain & ICO Agentur aus Berlin & München spezialisiert auf das digitale Umfeld. Wir verhelfen Unternehmen bei der Entwicklung innovativer Blockchain sowie ICO Projekte. Wir verhelfen unseren Kunden bei jedem Schritt ihres Projektvorgehens - von der Projekt..
Best SEO Company in India - SEO is an effective technique for promoting web pages in major search engines.,website,arvindchaurasiya009,SEO is an effective technique for promoting web pages in major search engines. If you want to SEO services for your website then go to click Best SEO Company in India. Tangensys SEO is the one of the Best SEO Company in India.
MyBackpackingOnline - Shopify FULL + FULL SITE - Full-Featured Store Ready to Sell,website,bikeschangea,My Backpacking Online Store INCLUDING SALE Physical inventory Domain Logo and brand assets After-sales personal support Product photos APPLICATIONS Oberlo BEST Currency Rates Countdown basket by Beeketing MailChimp for Shopify Tracking and Delivery Updates AfterShip..
Itercasino Bonus Code - GetCasiNobonus predents new bonuses,website,dannysmith,GetCasiNobonus predents new bonuses for all players. Now it's very simple to start playing our casinos. Get more bonuses and fun with us.
"Slot Win (Shopify App) - Grow your store 3x faster with gamification and interactive pop-ups allowing customers to ""earn"" fun prizes and discounts.",desktop app,eddy,"Slot Win is a unique Shopify application, with the potential to make $5,000/month or more!  In the app, customers will see a gameboard that looks like the game ""Plinko"" and they can enter their email to drop one ball down the board to win prizes like discounts or free shipping. The result? 3X more e.."
Megamadz - Mobile Marketing - Rich Media Ads,website,rich media ads,"""Megamadz is a leading mobile advertising company, we differentiates itself through the people we employ and the technology we have built. The company is 100% customer-centric, we pride ourselves on offering an exceptional customer experience each and every time. Additionally, we developed all our t.."
chatbots - artificial intelligence chat-bots with out help background human make easier your bussines,other,jagadeesh kumar,"Chatbots are currently seen on websites, social platforms and smartphones and are utilized as easy and fun ways to assist customers in their interactions with a brand. Even if the bot revolution is in its early phase, we can expect a lot more advancements in this field. We are delivering high-end an.."
SiteAnalyticsTools.com - Website Analytics Tools,website,mbwebd,"View IP, Source Code, Analytics, HTTP Status, DNS, Meta Tags, SSL, Domain Info and more."
CBT Master - CBT Master. A CBT quiz application to easily manage your online exams and quiz sessions.,website,namo,"CBT Master. a cbt quiz application to easily manage your online exams and quiz sessions. Electronically involve your students/job applicants for quiz, interviews etc."
WearTwoCamp - An outdoor inspired apparel brand,website,takethisout,"WearTwoCamp is an outdoor-inspired apparel brand. WearTwoCamp has been successful in the past few months, especially during the Black Friday weekend. Generating over $7,000 in profit."
Server Monitoring Software - Intuitive Server Monitoring Software for Prompt Results,website,ayushisharma,Intuitive Server Monitoring Software for Prompt Results.
KeywordAnalyzerTool.com - Keyword Analyzer Tool,website,mbwebd,"Generate a keyword analysis report. View popularity, volume by location, keyword suggestions and more."
Yurgen - GEODESIS - IS THE BASIS FOR ANY INVESTMENT,other,geoosnowa,Surveying measurements - this is the absolute basis for any subsequent measurements. Every mistake that will be made at this stage will prove to be fraught with consequences in subsequent stages. This is one of those works where we must have the certainty of achieving its reliable performance - if w..
Coup2coeur - Dropshipping Site / 6k mailing List / $10K Ave. Net Profit / Up to$50K/m gross $,website,chiaalain,This store grossed over $108k in only the first seven months of it's creation. It even made $50k+ in one month. Store has been optimized and ranks well in search engines.
coup2coeur - Dropshipping Site / 6k mailing List / $10K Ave. Net Profit / Up to$50K/m gross $,website,chiaalain,This store grossed over $108k in only the first seven months of it's creation. It even made $50k+ in one month. Store has been optimized and ranks well in search engines.
"IMPLEMENTATION OF TELEGRAM CHATBOT USING TELEPOT PYTHON FRAMEWORK - CUBot is a chatbot. A chatbot (also known as a talkbot, chatterbot, Bot, IM bot, interactive agent, or Artificial Conversational Entity) is a computer program which conducts a conversation via auditory or textual methods Such programs are often designed to convincingly simulate how a human would behave as a conversational partner, thereby passing the Turing test",other,sabeelmuttil,"CUBot is a chatbot. A chatbot (also known as a talkbot, chatterbot, Bot, IM bot, interactive agent, or Artificial Conversational Entity) is a computer program which conducts a conversation via auditory or textual methods Such programs are often designed to convincingly simulate how a human would beh.."
PakWheels Auto Parts & Accessories - Buy Auto Parts and Car Accessories in Pakistan,website,pakwheels,"From car care products like car wax, scratch remover, engine cleaners, leather care etc. to lights, and car parts like suspension, filters, side mirrors, grills, car bonnets, doors, brakes etc. you can find a variety to choose from depending on your car model."
Confidential Web App / Game - Hugely popular web app helps facilitate an in person family / party game!,website,mpcovcd,Confidental - please send email for url. Only looking to sell to fund another project. The site has been consistently growing year over year and pushes close to one million page views during peak holiday months.
"Dive.Management - Management system dedicated for a dive centers, diving schools, and diving bases.",website,dive.management,"Dive. Management is a software system developed specifically for use by dive centers, diving schools, and diving bases. It aims to minimize a paperwork, maximize an operational efficiencies and capture all data requirements in one place, in a very simple and intuitive way."
PROJECT MANAGEMENT SYSTEM - Project Management System is manage project like Tracking/Status of the task.,website,anjana,"Project Management System is manage project like Tracking/Status of the task. Manager automatic resources and time for mechanical task. The Project information given by the user for example, Make a Design of pages."
Watch Hunt - The easiest way to find a watch you'll love,website,nohaha,Watch Hunt is the best way to find watches you'll love.
Icloud customer care,website,hari0690,"Once you do so, you would get the entire list of the Icloud  help number and from there you can select the one which is pertinent to your trouble. The Icloud customer care help number is globally available and it is very easy to use. Furthermore, the experts have correct resolution to all troubles t.."
Cryptoast - The most secure cryptocurrency dashboard,website,alexsopinka,"Cryptoast is the most secure cryptocurrency dashboard. In order to keep your funds secure, it's super smart. but also a little dumb."
WearTwoCamp - An outdoor inspired apparel brand,website,takethisout,"WearTwoCamp is an outdoor-inspired apparel brand. WearTwoCamp has been successful in the past few months, especially during the Black Friday weekend. Generating over $7,000 in profit."
GramSpots.com - Browse Instagram by Location,website,mbwebd,Discover and explore Instagram locations. Browse locations and view full size Instagram pictures.
Zontik Games - Top 10 Ecommerce Site - Backgammon / Chess Sets,website,zontik,"Zontik Games sells backgammon, chess, and other types of board games. It was featured in over 20 publications around the world, including Playboy. It has been around since 2007."
Underbite - The ultimate iOS design inspiration resource,website,andy88jones,Underbite is an iOS design inspiration tool. It showcases a whole host of real life apps for all your design and development inpisration needs. It's built to a version one standard and I have a whole host of features for V2 which will require a front end developer who specialises in Wordpress.
Download Youtube - Site to download videos from YouTube with easy steps,website,murhuber,"Project including website, domains, texts an pictures. Fully functional download script available."
Easy-scraper - Web data extraction made easy,website,youss27,This project was developed to make data extraction as easy as possible. We also created an API for developers alongside an easy to use application for novice users.
WriteMyPaper4Me Writing Service - Essay writing help by professionals of WriteMyPaper4Me,website,writemypaper4me,"The author would need to share a lot of checks, and which will make proof of important experience. Fot that reason, we at Write My Paper For Me could modify all the report in order to match goals. We offer quite considerable trials quality whenever we participate cutting edge author in this staff me.."
Adiri - I will sell eShop specialised in Canadian baby bottles,website,bizpartner,"I will sell eShop specialised in Adiri baby bottles. Baby bottles are Canadian brand with unique design. Baby bottles are available to sell online, in stores with baby pruducts or for distribution to pharmacies."
Dance2Sense - Online dance classes and tutorials,website,dance2sense,"Dance2Sense is a great opportunity for people from all over the world to improve their dancing skills,learn from others and share their own style and creativity. This video-platform is created for everyone who dances and loves dancing,who wants to start and learn how to dance and  also for those who.."
"KikQuiz - Viral Online Fun Quizzes, Horoscopes and Facebook Apps",website,razvan,"Quiz Apps Website Like NAMETESTS, QUIZSTAR *NO RESERVE* Want to have a website like nametests, quizstar and all those Facebook viral tests? Here is your great opportunity to own yours with READY CONTENT READY TO GO! * NO RESERVE * Have you ever seen your friends sharing posts like “Where should yo.."
Walker Wayland AMD - Your team of Chartered Accountants and Business Advisors,website,walker wayland,"As one of the largest accounting, auditing, and business services in Western Australia's Peel region, we have offices in Mandurah and Pinjarra. There we work with local businesses and people to help them be successful. Included in our client base you'll find investors, private companies, association.."
ELearning Solution - Providing All Elearning Need for any Institute,website,ehtishamsiddiqui,"Developing e-learning is more expensive than preparing classroom materials and training the trainers, especially if multimedia or highly interactive methods are used. However, delivery costs for e-learning (including costs of web servers and technical support) are considerably lower than those for c.."
efeqti - To-do lists and task manager online EFEQTI,website,hgenvm,"To-do list and task manager online. Calendar organizer and task planner to-do list online, todo list, task planner online, task manager, task planner, projects planner, project manager, task manager online."
"My Dog Hut - this store is currently in highly popular niche, our predictions are $7500 - $12,500 a month in revenue.",website,mydoghut,My Dog Hut is your ultimate online resource for all the latest dog gadgets & accessories. We don’t only offer smarts; we also offer stylishness. Each and every one of the products that we offer bears the Y.
Boost - Boost is the only software in the world that allows you to create URLs the grab visitors email addresses from their social accounts with permissions.,website,hoanglo,"With Boost, you can create social signup URLs that allow your visitors to subscribe to your email list without having to type in their email addresses. Boost gets your visitors email addresses by asking for their permission to collect the information from their social accounts. Boost can even collec.."
Become A Nomad (includes email list of 2000 in the deal) - Online community to learn how to quit your job and live life on your own terms. Featured on Product Hunt.,website,eddy,"*FEATURED on Product Hunt, Beta List, Reddit, Indie Hackers, etc* Clean-design website for creating digital nomad community, and be able to make $2,000-$5,000+ a month through affiliate marketing, selling e-books, courses, etc about making money online/digital nomad lifestyle. Selling because of so.."
eCommerce - Profitable Online Store,website,1wayshop,"This is a brand new store and total revenue is almost US $7,000 in the past few months. The store also has over 4,000 Facebook likes and a big mailing list on it. The store has generated over $2,000."
"Spring - Low-Maintence, Startup Marketing website (Includes 1000 email list)",website,eddy,"Have helped raise 70K for crowdfunding campaigns! Spring is a website that specializes in growth-hacking and helping entrepreneurs, especially crowdfunding campaign owners, reach their goal and set growth plans to increase brand exposure. We have interviewed ""Shark Tank"" companies on our blog (attac.."
Easy-scraper - Web data extraction made easy,website,youss27,This project was developed to make data extraction as easy as possible. We also created an API for developers alongside an easy to use application for novice users.
WriteMyPaper4Me Writing Service - Essay writing help by professionals of WriteMyPaper4Me,website,writemypaper4me,"The author would need to share a lot of checks, and which will make proof of important experience. Fot that reason, we at Write My Paper For Me could modify all the report in order to match goals. We offer quite considerable trials quality whenever we participate cutting edge author in this staff me.."
Adiri - I will sell eShop specialised in Canadian baby bottles,website,bizpartner,"I will sell eShop specialised in Adiri baby bottles. Baby bottles are Canadian brand with unique design. Baby bottles are available to sell online, in stores with baby pruducts or for distribution to pharmacies."
Dance2Sense - Online dance classes and tutorials,website,dance2sense,"Dance2Sense is a great opportunity for people from all over the world to improve their dancing skills,learn from others and share their own style and creativity. This video-platform is created for everyone who dances and loves dancing,who wants to start and learn how to dance and  also for those who.."
