Quad Cities Waste Plant IL USA,United States of America,Please Select,41.4732,-90.5621,2,Please Select,Please Select,"Rock Island County, IL, USA",Please Select,1998-09-00,Gas Recovery Systems,100,,,,,,
RCWMD Badlands Landfill Gas Project Waste Plant CA USA,United States of America,Please Select,33.7437,-115.9925,1.3,Please Select,Please Select,"Riverside County, CA, USA",Please Select,2001-02-00,Riverside County Waste Management Dept,100,,,,,,
Rabun Gap Cogen Facility Waste Plant GA USA,United States of America,Please Select,34.878,-83.4037,4.1,Please Select,Please Select,"Rabun County, GA, USA",Please Select,1986-01-00,Rabun Apparel Inc,100,,,,,,
Randolph Electric Waste Plant MA USA,United States of America,Please Select,42.1547,-71.2171,3,Please Select,Please Select,"Norfolk County, MA, USA",Please Select,2000-02-00,Gas Recovery Systems,100,,,,,,
Rayonier Fernandina Mill Waste Plant FL USA,United States of America,Please Select,30.6622,-81.4842,32.5,Please Select,Please Select,"Nassau County, FL, USA",Please Select,1939-12-00,Plummer Forest Products Inc,100,,,,,,
Rayonier Jesup Mill Waste Plant GA USA,United States of America,Please Select,31.6592,-81.8439,82,Please Select,Please Select,"Wayne County, GA, USA",Please Select,1954-06-00,Plummer Forest Products Inc,100,,,,,,
Red Wing Waste Plant MN USA,United States of America,Please Select,44.5592,-92.5164,23,Please Select,Please Select,"Goodhue County, MN, USA",Please Select,1949-10-00,Northern States Power Co,100,,,,,,
Regional Waste Systems Waste Plant ME USA,United States of America,Please Select,43.6538,-70.3343,13.3,Please Select,Please Select,"Cumberland County, ME, USA",Please Select,1988-06-00,Ecomaine,100,,,,,,
Reliant Baytown Waste Plant TX USA,United States of America,Please Select,29.7438,-94.6122,5.2,Please Select,Please Select,"Chambers County, TX, USA",Please Select,2003-12-00,Viridis Energy,100,,,,,,
Reliant Bluebonnet Waste Plant TX USA,United States of America,Please Select,29.8614,-95.3996,4,Please Select,Please Select,"Harris County, TX, USA",Please Select,2003-08-00,Viridis Energy,100,,,,,,
Reliant Coastal Plains Waste Plant TX USA,United States of America,Please Select,29.4002,-94.9654,5.2,Please Select,Please Select,"Galveston County, TX, USA",Please Select,2003-03-00,Viridis Energy,100,,,,,,
Reliant Conroe Waste Plant TX USA,United States of America,Please Select,30.3044,-95.5033,3,Please Select,Please Select,"Montgomery County, TX, USA",Please Select,2003-08-00,Viridis Energy,100,,,,,,
Reliant Energy Renewables Atascosita Waste Plant TX USA,United States of America,Please Select,29.8614,-95.3996,6.5,Please Select,Please Select,"Harris County, TX, USA",Please Select,2003-03-00,Viridis Energy,100,,,,,,
Reliant Security Waste Plant TX USA,United States of America,Please Select,30.1546,-94.8173,3.9,Please Select,Please Select,"Liberty County, TX, USA",Please Select,2003-12-00,Viridis Energy,100,,,,,,
Richmond Electric Waste Plant VA USA,United States of America,Please Select,37.4337,-77.4212,3,Please Select,Please Select,"Henrico County, VA, USA",Please Select,1993-08-00,Gas Recovery Systems,100,,,,,,
Ridge Generating Station Waste Plant FL USA,United States of America,Please Select,28.0281,-81.7424,47.1,Please Select,Please Select,"Polk County, FL, USA",Please Select,1994-03-00,Wheelabrator Environmental Systems,100,,,,,,
Ridgeview Waste Plant WI USA,United States of America,Please Select,44.1203,-87.8043,3.2,Please Select,Please Select,"Manitowoc County, WI, USA",Please Select,2002-09-00,Bio-Energy Partners,100,,,,,,
Rio Bravo Fresno Waste Plant CA USA,United States of America,Please Select,36.6873,-119.7267,28,Please Select,Please Select,"Fresno County, CA, USA",Please Select,1988-07-00,Rio Bravo Fresno,100,,,,,,
Rio Bravo Rocklin Waste Plant CA USA,United States of America,Please Select,38.8329,-121.318,27.9,Please Select,Please Select,"Placer County, CA, USA",Please Select,1989-06-00,Rio Bravo Rocklin,100,,,,,,
Rio Grande Valley Sugar Growers Waste Plant TX USA,United States of America,Please Select,26.4012,-98.1913,7.5,Please Select,Please Select,"Hidalgo County, TX, USA",Please Select,1973-10-00,Rio Grande Valley Sugar Growers. Inc.,100,,,,,,
Riverview Energy Systems Waste Plant MI USA,United States of America,Please Select,42.2878,-83.2903,6.6,Please Select,Please Select,"Wayne County, MI, USA",Please Select,1988-01-00,Riverview Energy Systems,100,,,,,,
Riveside Resource Recovery LLC Waste Plant IL USA,United States of America,Please Select,41.4481,-87.9852,1.1,Please Select,Please Select,"Will County, IL, USA",Please Select,1997-02-00,Illinois Electricial Gen Partn,100,,,,,,
Robbins Lumber Waste Plant ME USA,United States of America,Please Select,44.5027,-69.1463,3.2,Please Select,Please Select,"Waldo County, ME, USA",Please Select,1987-01-00,Robbins Lumber Inc,100,,,,,,
Rockford Electric Waste Plant IL USA,United States of America,Please Select,42.0427,-89.3256,2,Please Select,Please Select,"Ogle County, IL, USA",Please Select,1996-01-00,Gas Recovery Systems,100,,,,,,
Rolls Royce Waste Plant IN USA,United States of America,Please Select,39.7845,-86.1496,15.5,Please Select,Please Select,"Marion County, IN, USA",Please Select,1963-08-00,Rolls Royce Corp,16.129,,,,,,
Roosevelt Biogas 1 Waste Plant WA USA,United States of America,Please Select,45.8712,-120.7878,10.5,Please Select,Please Select,"Klickitat County, WA, USA",Please Select,1999-06-00,PUD No 1 of Klickitat County,100,,,,,,
Roxana Resource Recovery Waste Plant IL USA,United States of America,Please Select,38.8308,-89.9103,4.4,Please Select,Please Select,"Madison County, IL, USA",Please Select,1999-11-00,Illinois Electricial Gen Partn,100,,,,,,
Ryegate Power Station Waste Plant VT USA,United States of America,Please Select,44.2125,-72.0583,21.5,Please Select,Please Select,"Caledonia County, VT, USA",Please Select,1992-09-00,Catamount Energy Corp,33,,,,,,
SDS Lumber Gorge Energy Division Waste Plant WA USA,United States of America,Please Select,45.7106,-121.4728,10,Please Select,Please Select,"Klickitat County, WA, USA",Please Select,1985-07-00,SDS Lumber Co,100,,,,,,
SEMASS Resource Recovery Waste Plant MA USA,United States of America,Please Select,41.8033,-70.7887,98.5,Please Select,Please Select,"Plymouth County, MA, USA",Please Select,1988-07-00,Covanta Energy,100,,,,,,
SPSA Waste To Energy Power Plant Waste Plant VA USA,United States of America,Please Select,36.8399,-76.3573,60,Please Select,Please Select,"Portsmouth City County, VA, USA",Please Select,1987-10-00,Southeastern Public Serv Auth,100,,,,,,
STEC-S LLC Waste Plant AR USA,United States of America,Please Select,34.2914,-91.3678,18,Please Select,Please Select,"Arkansas County, AR, USA",Please Select,1997-01-00,Riceland Foods Inc.,49,,,,,,
Salem Energy Systems LLC Waste Plant NC USA,United States of America,Please Select,36.1256,-80.2534,4.5,Please Select,Please Select,"Forsyth County, NC, USA",Please Select,1996-07-00,Michigan Cogeneration Sys Inc,100,,,,,,
Salinas Waste Plant CA USA,United States of America,Please Select,36.2158,-121.227,1.4,Please Select,Please Select,"Monterey County, CA, USA",Please Select,1986-12-00,Covanta Energy,100,,,,,,
San Marcos Waste Plant CA USA,United States of America,Please Select,33.0362,-116.7356,1.8,Please Select,Please Select,"San Diego County, CA, USA",Please Select,1990-05-00,Landfill Generating Partners,100,,,,,,
Santa Maria EPG Waste Plant CA USA,United States of America,Please Select,35.3877,-120.3974,5.8,Please Select,Please Select,"San Luis Obispo County, CA, USA",Please Select,1995-12-00,ConocoPhillips,100,,,,,,
Sappi Cloquet Mill Waste Plant MN USA,United States of America,Please Select,46.7244,-92.4314,94.5,Please Select,Please Select,"Carlton County, MN, USA",Please Select,1976-01-00,Minnesota Power Inc,29.2063,,,,,,
Sauder Power Plant Waste Plant OH USA,United States of America,Please Select,41.6008,-84.1213,7.2,Please Select,Please Select,"Fulton County, OH, USA",Please Select,1993-10-00,Sauder Woodworking Co,100,,,,,,
Seneca Energy Waste Plant NY USA,United States of America,Please Select,42.784,-76.8236,11.2,Please Select,Please Select,"Seneca County, NY, USA",Please Select,1998-08-00,Seneca Energy II,100,,,,,,
Settlers Hill Gas Recovery Waste Plant IL USA,United States of America,Please Select,41.9406,-88.4339,6,Please Select,Please Select,"Kane County, IL, USA",Please Select,1988-10-00,Waste Management Inc,100,,,,,,
Seven Mile Creek LFG Waste Plant WI USA,United States of America,Please Select,44.7253,-91.287,3,Please Select,Please Select,"Eau Claire County, WI, USA",Please Select,2004-04-00,Dairyland Power Coop,100,,,,,,
Shenango Neville Island Coke Works Waste Plant PA USA,United States of America,Please Select,40.4967,-80.0756,11.3,Please Select,Please Select,"Allegheny County, PA, USA",Please Select,1920-07-00,Shenango Inc,100,,,,,,
Short Mountain Waste Plant OR USA,United States of America,Please Select,43.931,-122.8437,3.2,Please Select,Please Select,"Lane County, OR, USA",Please Select,1992-02-00,Emerald People's Utility Dist,100,,,,,,
Sierra Pacific Aberdeen Waste Plant WA USA,United States of America,Please Select,47.149,-123.7713,18,Please Select,Please Select,"Grays Harbor County, WA, USA",Please Select,2003-03-00,Sierra Pacific Resources NUGs,100,,,,,,
Sierra Pacific Anderson Facility Waste Plant CA USA,United States of America,Please Select,40.7587,-122.0344,4,Please Select,Please Select,"Shasta County, CA, USA",Please Select,1999-01-00,Sierra Pacific Resources NUGs,100,,,,,,
Sierra Pacific Burney Facility Waste Plant CA USA,United States of America,Please Select,40.4728,-122.3292,20,Please Select,Please Select,"Shasta County, CA, USA",Please Select,1986-10-00,Sierra Pacific Resources NUGs,100,,,,,,
Sierra Pacific Lincoln Facility Waste Plant CA USA,United States of America,Please Select,39.0139,-120.7421,32.2,Please Select,Please Select,"Placer County, CA, USA",Please Select,2004-03-00,Sierra Pacific Resources NUGs,100,,,,,,
Sierra Pacific Loyalton Facility Waste Plant CA USA,United States of America,Please Select,39.6694,-120.2333,20,Please Select,Please Select,"Sierra County, CA, USA",Please Select,1989-09-00,Sierra Pacific Resources NUGs,100,,,,,,
Sierra Pacific Quincy Facility Waste Plant CA USA,United States of America,Please Select,40.0157,-120.8496,27.5,Please Select,Please Select,"Plumas County, CA, USA",Please Select,1986-12-00,Sierra Pacific Resources NUGs,100,,,,,,
Sierra Pacific Sonora Waste Plant CA USA,United States of America,Please Select,38.025,-119.9464,7.5,Please Select,Please Select,"Tuolumne County, CA, USA",Please Select,2001-02-00,Sierra Pacific Resources NUGs,100,,,,,,
Sierra Pacific Susanville Waste Plant CA USA,United States of America,Please Select,40.67,-120.5889,14.2,Please Select,Please Select,"Lassen County, CA, USA",Please Select,,Sierra Pacific Resources NUGs,100,,,,,,
Sierra Power Waste Plant CA USA,United States of America,Please Select,36.2199,-118.792,7.5,Please Select,Please Select,"Tulare County, CA, USA",Please Select,1985-12-00,Sierra Pacific Resources NUGs,100,,,,,,
Smithtown Energy Partners LP Waste Plant NY USA,United States of America,Please Select,40.8803,-72.8434,1.4,Please Select,Please Select,"Suffolk County, NY, USA",Please Select,1988-08-00,Smithtown Energy Partners LP,100,,,,,,
Smurfit Stone Waste Plant AL USA,United States of America,Please Select,31.0772,-87.1006,38.9,Please Select,Please Select,"Escambia County, AL, USA",Please Select,1957-10-00,Smurfit-Stone Corp,100,,,,,,
Snider Industries Waste Plant TX USA,United States of America,Please Select,32.5471,-94.3738,5,Please Select,Please Select,"Harrison County, TX, USA",Please Select,1983-08-00,Snider Industries Inc,100,,,,,,
Somerset Plant Waste Plant ME USA,United States of America,Please Select,45.5095,-69.9566,116.9,Please Select,Please Select,"Somerset County, ME, USA",Please Select,1976-01-00,Sappi North America,100,,,,,,
Sonoma Central Landfill Phase I Waste Plant CA USA,United States of America,Please Select,38.5274,-122.8826,3.2,Please Select,Please Select,"Sonoma County, CA, USA",Please Select,1993-07-00,County of Sonoma Dept of Trnsp,100,,,,,,
Sonoma Central Landfill Phase II Waste Plant CA USA,United States of America,Please Select,38.5274,-122.8826,3.2,Please Select,Please Select,"Sonoma County, CA, USA",Please Select,1996-06-00,County of Sonoma Dept of Trnsp,100,,,,,,
South Barrington Electric Waste Plant IL USA,United States of America,Please Select,41.8555,-88.0921,1.6,Please Select,Please Select,"Du Page County, IL, USA",Please Select,1997-06-00,Gas Recovery Systems,100,,,,,,
South District Wastewater Treatment Plt Waste Plant FL USA,United States of America,Please Select,25.6163,-80.5689,2.7,Please Select,Please Select,"Miami-Dade County, FL, USA",Please Select,1991-03-00,Miami Dade Water & Sewer Auth,100,,,,,,
South West Landfill Waste Plant FL USA,United States of America,Please Select,29.6761,-82.354,2.4,Please Select,Please Select,"Alachua County, FL, USA",Please Select,2003-11-00,Gainesville Regional Utilities,100,,,,,,
Southeast Resource Recovery Waste Plant CA USA,United States of America,Please Select,33.7607,-118.2398,35.6,Please Select,Please Select,"Los Angeles County, CA, USA",Please Select,1988-07-00,Los Angeles County Sanitation,38.5,,,,,,
Spadra Landfill Gas to Energy Waste Plant CA USA,United States of America,Please Select,34.027,-118.0298,10.6,Please Select,Please Select,"Los Angeles County, CA, USA",Please Select,1990-02-00,Los Angeles County Sanitation,100,,,,,,
Sparrows Point Waste Plant MD USA,United States of America,Please Select,39.2125,-76.4625,120,Please Select,Please Select,"Baltimore County, MD, USA",Please Select,1949-01-00,Mittal USA,100,,,,,,
St Francisville Mill Waste Plant LA USA,United States of America,Please Select,30.7083,-91.3333,12.5,Please Select,Please Select,"West Feliciana County, LA, USA",Please Select,1966-03-00,Tembec USA. LLC,100,,,,,,
Stone Container Coshocton Mill Waste Plant OH USA,United States of America,Please Select,40.2789,-81.865,16.5,Please Select,Please Select,"Coshocton County, OH, USA",Please Select,1981-11-00,Smurfit-Stone Corp,100,,,,,,
Stone Container Hodge Waste Plant LA USA,United States of America,Please Select,32.2744,-92.7269,74.4,Please Select,Please Select,"Jackson County, LA, USA",Please Select,1938-01-00,Smurfit-Stone Corp,100,,,,,,
Stone Container Missoula Mill Waste Plant MT USA,United States of America,Please Select,46.9507,-114.1254,17.3,Please Select,Please Select,"Missoula County, MT, USA",Please Select,1960-11-00,Smurfit-Stone Corp,100,,,,,,
Stowe Power Production Plant Waste Plant PA USA,United States of America,Please Select,40.2094,-75.3727,6,Please Select,Please Select,"Montgomery County, PA, USA",Please Select,1989-03-00,Waste Management Inc,100,,,,,,
Streator Energy Partners LLC Waste Plant IL USA,United States of America,Please Select,41.3458,-88.8936,1.1,Please Select,Please Select,"La Salle County, IL, USA",Please Select,1999-12-00,Illinois Electricial Gen Partn,100,,,,,,
Suffolk Energy Partners LP Waste Plant VA USA,United States of America,Please Select,36.6963,-76.6444,3.2,Please Select,Please Select,"Suffolk County, VA, USA",Please Select,1994-11-00,Suffolk Energy Partners LP,100,,,,,,
Sumpter Energy Associates Waste Plant MI USA,United States of America,Please Select,42.2878,-83.2903,12,Please Select,Please Select,"Wayne County, MI, USA",Please Select,1998-07-00,Michigan Cogeneration Sys Inc,100,,,,,,
Sunset Farms Waste Plant TX USA,United States of America,Please Select,30.3357,-97.7876,3,Please Select,Please Select,"Travis County, TX, USA",Please Select,1996-12-00,Gas Recovery Systems,100,,,,,,
Superior Glacier Ridge Landfill Waste Plant WI USA,United States of America,Please Select,43.4181,-88.7061,2,Please Select,Please Select,"Dodge County, WI, USA",Please Select,2001-02-00,Montenay Power Corp,100,,,,,,
Sycamore San Diego Waste Plant CA USA,United States of America,Please Select,33.0362,-116.7356,1.8,Please Select,Please Select,"San Diego County, CA, USA",Please Select,1989-12-00,Landfill Generating Partners,100,,,,,,
Tajiguas Landfill Waste Plant CA USA,United States of America,Please Select,34.6688,-120.0125,3,Please Select,Please Select,"Santa Barbara County, CA, USA",Please Select,2000-08-00,Fortistar LLC,100,,,,,,
Tamarack Energy Partnership Waste Plant ID USA,United States of America,Please Select,44.8855,-116.4518,6.2,Please Select,Please Select,"Adams County, ID, USA",Please Select,1983-06-00,Tamarack Energy Partners,100,,,,,,
Taunton Landfill Waste Plant MA USA,United States of America,Please Select,41.7988,-71.1154,1.8,Please Select,Please Select,"Bristol County, MA, USA",Please Select,1997-09-00,Fortistar LLC,100,,,,,,
Taylor Energy Partners LP Waste Plant PA USA,United States of America,Please Select,41.4386,-75.613,3.1,Please Select,Please Select,"Lackawanna County, PA, USA",Please Select,1987-09-00,Zapco Energy Tactics Corp,100,,,,,,
Tazewell Gas Recovery Waste Plant IL USA,United States of America,Please Select,40.5096,-89.5186,2.4,Please Select,Please Select,"Tazewell County, IL, USA",Please Select,1989-07-00,Waste Management Inc,100,,,,,,
Tillamook Lumber Waste Plant OR USA,United States of America,Please Select,45.455,-123.7068,10,Please Select,Please Select,"Tillamook County, OR, USA",Please Select,,Willamina Lumber Co,100,,,,,,
Tillotson Rubber Waste Plant NH USA,United States of America,Please Select,44.6861,-71.3076,1.4,Please Select,Please Select,"Coos County, NH, USA",Please Select,1980-06-00,Tillotson Rubber Co Inc,100,,,,,,
Total Energy Facilities Waste Plant CA USA,United States of America,Please Select,34.3209,-118.2212,45.1,Please Select,Please Select,"Los Angeles County, CA, USA",Please Select,2003-02-00,Los Angeles County Sanitation,100,,,,,,
Toyon Power Station Waste Plant CA USA,United States of America,Please Select,34.3209,-118.2212,9,Please Select,Please Select,"Los Angeles County, CA, USA",Please Select,1986-01-00,Covanta Energy,100,,,,,,
Tracy Biomass Waste Plant CA USA,United States of America,Please Select,37.7213,-121.481,23,Please Select,Please Select,"San Joaquin County, CA, USA",Please Select,1990-05-00,U S Renewables Group,100,,,,,,
Tri Cities Waste Plant AZ USA,United States of America,Please Select,33.3596,-112.4878,5,Please Select,Please Select,"Maricopa County, AZ, USA",Please Select,2001-09-00,Salt River Project,100,,,,,,
Turnkey Landfill Gas Recovery Waste Plant NH USA,United States of America,Please Select,43.2981,-71.0321,9.2,Please Select,Please Select,"Strafford County, NH, USA",Please Select,1992-02-00,Bio-Energy Partners,100,,,,,,
Twin Bridges Gas Recovery Waste Plant IN USA,United States of America,Please Select,39.7771,-86.5197,3.2,Please Select,Please Select,"Hendricks County, IN, USA",Please Select,1994-10-00,Wabash Valley Power Assn. Inc,100,,,,,,
Union County Resource Recovery Waste Plant NJ USA,United States of America,Please Select,40.6006,-74.2684,45,Please Select,Please Select,"Union County, NJ, USA",Please Select,1994-02-00,Union County Utilities Auth,100,,,,,,
Upper Rock Energy Partners LLC Waste Plant IL USA,United States of America,Please Select,41.4732,-90.5621,3.3,Please Select,Please Select,"Rock Island County, IL, USA",Please Select,2000-04-00,Illinois Electricial Gen Partn,100,,,,,,
Valero Refinery Cogeneration Unit 1 Waste Plant CA USA,United States of America,Please Select,38.2799,-121.9168,51,Please Select,Please Select,"Solano County, CA, USA",Please Select,2002-10-00,Valero Refining Co,100,,,,,,
Venice Resources Gas Recovery Waste Plant MI USA,United States of America,Please Select,42.9563,-84.1485,1.6,Please Select,Please Select,"Shiawassee County, MI, USA",Please Select,1992-03-00,Bio-Energy Partners,100,,,,,,
Viking Energy of Lincoln Waste Plant MI USA,United States of America,Please Select,44.6794,-83.4225,18,Please Select,Please Select,"Alcona County, MI, USA",Please Select,1989-01-00,SUEZ Energy Resources NA Inc,100,,,,,,
Viking Energy of McBain Waste Plant MI USA,United States of America,Please Select,44.1961,-85.2231,18,Please Select,Please Select,"Missaukee County, MI, USA",Please Select,1988-12-00,SUEZ Energy Resources NA Inc,100,,,,,,
Viking Energy of Northumberland Waste Plant PA USA,United States of America,Please Select,40.9183,-76.804,18,Please Select,Please Select,"Northumberland County, PA, USA",Please Select,1988-11-00,SUEZ Energy Resources NA Inc,100,,,,,,
Village Creek Wastewater Treatment Plant Waste Plant TX USA,United States of America,Please Select,32.7738,-97.2852,13.5,Please Select,Please Select,"Tarrant County, TX, USA",Please Select,1994-04-00,Ft Worth City of,100,,,,,,
Visalia Landfill Gas Utilization Project Waste Plant CA USA,United States of America,Please Select,36.2199,-118.792,1.8,Please Select,Please Select,"Tulare County, CA, USA",Please Select,1998-05-00,Fortistar LLC,100,,,,,,
Volusia Landfill Gas Utilization Project Waste Plant FL USA,United States of America,Please Select,29.0608,-81.1897,3.8,Please Select,Please Select,"Volusia County, FL, USA",Please Select,1998-06-00,Fortistar LLC,100,,,,,,
Wadham Energy LP Waste Plant CA USA,United States of America,Please Select,39.0977,-122.0853,28.6,Please Select,Please Select,"Colusa County, CA, USA",Please Select,1989-03-00,Enpower Corp,100,,,,,,
Walter B Hall Resource Recovery Facility Waste Plant OK USA,United States of America,Please Select,36.1298,-96.0186,16.8,Please Select,Please Select,"Tulsa County, OK, USA",Please Select,1989-01-00,Barlow Operators of Tulsa. LLC,100,,,,,,
Warm Springs Forest Products Waste Plant OR USA,United States of America,Please Select,44.6233,-121.1729,9,Please Select,Please Select,"Jefferson County, OR, USA",Please Select,1977-01-00,Warm Springs Forest Prod Indst,100,,,,,,
Wasatch Energy Systems Energy Recovery Waste Plant UT USA,United States of America,Please Select,40.9897,-112.1096,1.6,Please Select,Please Select,"Davis County, UT, USA",Please Select,1986-08-00,Davis CSWM  and  Energy RSSD,100,,,,,,
Wauna Mill Waste Plant OR USA,United States of America,Please Select,45.9827,-123.6553,36,Please Select,Please Select,"Clatsop County, OR, USA",Please Select,1996-02-00,Western Generation Agency,100,,,,,,
West Point Treatment Plant Waste Plant WA USA,United States of America,Please Select,47.4884,-121.8011,3.9,Please Select,Please Select,"King County, WA, USA",Please Select,1983-06-00,King County Dept-Natural Res,100,,,,,,
Weyerhaeuser Cosmopolis Waste Plant WA USA,United States of America,Please Select,46.9556,-123.7653,15,Please Select,Please Select,"Grays Harbor County, WA, USA",Please Select,1957-01-00,Weyerhaeuser Co,100,,,,,,
Weyerhaeuser Kentucky Mills Waste Plant KY USA,United States of America,Please Select,37.9086,-86.8111,88,Please Select,Please Select,"Hancock County, KY, USA",Please Select,2001-06-00,Weyerhaeuser Co,100,,,,,,
Weyerhaeuser Kingsport Mill Waste Plant TN USA,United States of America,Please Select,36.5489,-82.5667,19,Please Select,Please Select,"Sullivan County, TN, USA",Please Select,1956-01-00,Weyerhaeuser Co,100,,,,,,
Weyerhaeuser New Bern NC Waste Plant NC USA,United States of America,Please Select,35.2081,-77.1242,29.7,Please Select,Please Select,"Craven County, NC, USA",Please Select,1969-12-00,Weyerhaeuser Co,100,,,,,,
Weyerhaeuser Springfield Oregon Waste Plant OR USA,United States of America,Please Select,44.0458,-122.9806,65,Please Select,Please Select,"Lane County, OR, USA",Please Select,1949-01-00,Eugene Water & Electric Board,61.5385,,,,,,
Weyerhaeuser Valliant OK Waste Plant OK USA,United States of America,Please Select,33.9208,-95.0833,68,Please Select,Please Select,"McCurtain County, OK, USA",Please Select,1971-10-00,Weyerhaeuser Co,100,,,,,,
Weyerhaeuser Wright City Complex OK Waste Plant OK USA,United States of America,Please Select,34.1177,-94.7674,5,Please Select,Please Select,"McCurtain County, OK, USA",Please Select,1980-01-00,Weyerhaeuser Co,100,,,,,,
Wheelabrator Baltimore Refuse Waste Plant MD USA,United States of America,Please Select,39.2688,-76.6321,64.5,Please Select,Please Select,"Baltimore City County, MD, USA",Please Select,1984-11-00,Wheelabrator Environmental Systems,100,,,,,,
Wheelabrator Bridgeport Waste Plant CT USA,United States of America,Please Select,41.3245,-73.4084,67,Please Select,Please Select,"Fairfield County, CT, USA",Please Select,1988-07-00,Waste Energy II LLC,100,,,,,,
Wheelabrator Claremont Facility Waste Plant NH USA,United States of America,Please Select,43.3593,-72.224,4.5,Please Select,Please Select,"Sullivan County, NH, USA",Please Select,1987-03-00,Wheelabrator Environmental Systems,100,,,,,,
Wheelabrator Concord Facility Waste Plant NH USA,United States of America,Please Select,43.1983,-71.5468,14,Please Select,Please Select,"Merrimack County, NH, USA",Please Select,1989-04-00,Wheelabrator Environmental Systems,100,,,,,,
Wheelabrator Falls Waste Plant PA USA,United States of America,Please Select,40.1656,-74.7673,53.3,Please Select,Please Select,"Bucks County, PA, USA",Please Select,1994-05-00,Waste Management Inc,100,,,,,,
Wheelabrator Gloucester LP Waste Plant NJ USA,United States of America,Please Select,39.8463,-75.1803,14,Please Select,Please Select,"Gloucester County, NJ, USA",Please Select,1990-01-00,Wheelabrator Environmental Systems,100,,,,,,
Wheelabrator Hudson Falls Waste Plant NY USA,United States of America,Please Select,43.306,-73.591,14.4,Please Select,Please Select,"Washington County, NY, USA",Please Select,1991-11-00,Counties of Warren & Washington IDA,100,,,,,,
Wheelabrator Lisbon Waste Plant CT USA,United States of America,Please Select,41.4946,-72.1276,14.6,Please Select,Please Select,"New London County, CT, USA",Please Select,1995-10-00,Eastern Conn Res Recvy Auth,100,,,,,,
