Name,Country,Status,Latitude,Longitude,Design Capacity,Plant Type,Plant Use,Location,Power Grid,Cooling Water,Year Commissioned,Owner,Per Owner,Ownership Type,EPC Contractor,Operating Company,Regulatory Authority,Financed By,Reference
Datteln Coal CHP Power Plant Germany,Germany,Operating Partially,51.6295,7.3313,303,Sub-critical Thermal,Please Select,"Datteln, North Rhine-Westphalia, Germany",National Grid,Datteln-Hamm Canal,1964-00-00,E.ON Power,100,,,E.ON Power,,,http://www.eon.com/en/about-us/structure/asset-finder/datteln.html
Duisburg-Walsum Coal CHP Power Plant Germany,Germany,Operating Fully,51.52849,6.71389,1285,Both Sub and Super Critical Thermal,Please Select,"Walsum, North Rhine-Westphalia, Germany",National Grid,Rhine River,1959-00-00,STEAG GmbH (100% owner of blocks 7 and 9),51,,,Steag Power GmbH,,,http://www.steag.com/walsum.html
Frimmersdorf Coal Power Plant Germany,Germany,Operating Fully,51.0555,6.5767,2413,Sub-critical Thermal,Base Load,"Frimmersdorf, North Rhine-Westphalia, Germany",National Grid,Erft River,1955-00-00,RWE Power,,,,RWE Power,,,http://www.rwe.com/web/cms/en/9002/rwe-power-ag/locations/lignite/frimmersdorf-power-plant/
Großkrotzenburg (Staudinger) Coal CHP Power Station Germany,Germany,Operating Fully,50.088,8.9522,1823,Sub-critical Thermal,Base Load,"Großkrotzenburg, Hesse, Germany",National Grid,Main River,1965-00-00,E.ON Kraftwerke GmbH,,Private,,E.ON Kraftwerke GmbH,,,http://www.eon.com/content/eon-com/en/about-us/structure/asset-finder/staudinger.html
Gustav Knepper Coal Power Plant Germany,Germany,Operating Fully,51.5683,7.3489,364,Sub-critical Thermal,Please Select,"Dortmund, North Rhine-Westphalia, Germany",National Grid,,1971-00-00,E.ON Energie,100,,,E.ON Energie,,,http://www.eon.com/content/eon-com/de/about-us/structure/asset-finder/knepper-power-station.html
Hamburg-Moorburg CHP Coal Power Plant Gerrmany,Germany,Built and In Test Stage,53.489,9.949,1640,Ultra-Super-Critical Thermal,Base Load,"Moorburg, Hamburg, Germany",National Grid,Elbe River,2014-00-00,Vattenfall Europe,,,,Vattenfall Europe,,,http://www.vattenfall.de/de/moorburg/das-kraftwerk-moorburg.htm
Heilbronn Coal CHP Power Plant Germany,Germany,Operating Fully,49.176,9.2073,1066,Sub-critical Thermal,Base Load,"Heilbronn, Baden-Wurttemberg, Germany",National Grid,Neckar River,1965-00-00,EnBW Kraftwerke AG,,,,EnBW Kraftwerke AG,,,http://www.enbw.com/unternehmen/konzern/energieerzeugung/fossile-energie/standorte.html
Herne Coal CHP Power Plant Germany,Germany,Operating Fully,51.5502,7.18727,950,Sub-critical Thermal,Base Load,"Herne, North Rhine-Westphalia, Germany",National Grid,Rhine-Herne Canal,1962-00-00,Steag GmbH,100,Private,,STEAG GmbH,,,http://www.steag.com/herne+M52087573ab0.html   http://www.steag.com/herne.html
Heyden Coal Power Plant Germany,Germany,Operating Fully,52.3819,8.998333,875,Sub-critical Thermal,Base Load,"15 kilometers north of Minden, North Rhine-Westphalia, Germany",National Grid,,1987-04-23,E.ON Kraftwerke GmbH,,,,E.ON Kraftwerke GmbH,,,http://www.eon.com/de/ueber-uns/struktur/asset-finder/heyden.html
Ibbenburen Coal Power Plant Germany,Germany,Operating Fully,52.2865,7.7464,838,Sub-critical Thermal,Base Load,"Ibbenburen, North Rhine-Westphalia, Germany",Please Select,,1985-06-19,RWE Power AG,100,,Veba Kraftwerke Ruhr AG,RWE Power AG,,,http://www.rwe.com/web/cms/en/1770936/rwe-generation-se/locations/germany/ibbenbueren-power-plant/
Janschwalde Coal Power Plant Germany,Germany,Operating Fully,51.8347,14.4603,3000,Sub-critical Thermal,Base Load,"Near Peitz Janschwalde, Brandenburg, Germany",National Grid,,1981-00-00,Vattenfall,,,,Vattenfall,,,http://powerplants.vattenfall.com/node/288
Karlsruhe RDK 7 and 8 Power Plant Germany,Germany,Operating Fully,49.0131,8.308,1462,Both Sub and Super Critical Thermal,Base/Intermediate Load,"Karlsruhe, Baden-Wurttemberg, Germany",National Grid,Rhine River,1985-00-00,EnBW Rhinehafen,,Private,,EnBW Rhinehafen,,,http://www.enbw.com/
Klingenberg CHP Coal Power Plant Germany,Germany,Operating Fully,52.4889,13.4968,188,Sub-critical Thermal,Base Load,"Berlin, Germany",National Grid,,1927-00-00,Vattenfall,100,Private,,Vattenfall,,,http://powerplants.vattenfall.com/node/300
Knepper CHP Coal Power Plant Germany,Germany,Operating Fully,51.5683,7.3494,345,Sub-critical Thermal,Please Select,"Castrop-Rauxel, Dortmund, North Rhine-Westphalia, Germany",National Grid,,1971-00-00,E.ON Power,,,,E.ON Power,,,http://www.eon.com/de/ueber-uns/struktur/asset-finder/knepper-power-station.html
Lausward E CHP Coal Power Plant Germany,Germany,Operating Fully,51.222,6.7317,458,Sub-critical Thermal,Please Select,"Dusseldorf, North Rhine-Westphalia, Germany",National Grid,Rhein River,1974-00-00,Stadtwerke Dusseldorf,,,,Stadtwerke Dusseldorf,,,http://www.swd-ag.de/privatkunden/strom/stromerzeugung.php
Lippendorf Coal Power Plant Germany,Germany,Operating Fully,51.1822,12.3733,1866,Super-critical Thermal,Base Load,"Lippendorf, Neukieritzsch, Saxony, Germany",National Grid,,1999-00-00,Vattenfall,50,Private,"ABB, Heitkamp Ingenieur- und Kraftwerksbau",Vattenfall Europe,,,http://powerplants.vattenfall.com/node/293
Lünen CHP Coal Power Plant Germany,Germany,Operating Fully,51.6142,7.4805,507,Sub-critical Thermal,Base/Intermediate Load,"Lunen, North Rhine-Westphalia, Germany",National Grid,,1962-00-00,Stadtwerke-Rhein-Ruhr consortium,,,,Steag Power GmbH,,,http://www.steag.com/luenen.html
Lünen Trianel Coal Power Plant Germany,Germany,Operating Fully,51.61412,7.46155,750,Ultra-Super-Critical Thermal,Base Load,"Datteln-Hamm Canal, Lunen, North Rhine-Westphalia, Germany",National Grid,Datteln-Hamm Canal,2013-12-01,Trianel,,,,Trianel,,,http://www.trianel-luenen.de/
Mannheim Coal CHP Power Plant Germany,Germany,Operating Fully,49.4442,8.5001,1455,Sub-critical Thermal,Base Load,"Mannheim-Neckarau, Baden-Wurttemberg, Germany",National Grid,Rhine River,1970-00-00,RWE Power,40,Privte,,Grosskraftwerk Mannheim (GKM),,,http://www.gkm.de/
Mehrum Coal Power Plant Germany,Germany,Operating Fully,52.315,10.093,750,Sub-critical Thermal,Please Select,"Mehrum, Lower Saxony, Germany",National Grid,Mittellandkanal,1979-00-00,Stadtwerke Hannover AG,83.3,,,Kraftwerk Mehrum GmbH,,,http://www.kraftwerk-mehrum.de/kraftwerk-mehrum-start.htm   http://www.kraftwerk-mehrum.de/01-content/Kraftwerk-FaktenZahlen.htm
Munchen Nord CHP Power Plant Germany,Germany,Operating Fully,48.1805,11.6393,360,Sub-critical Thermal,Base Load,"Munich, Bavaria, Germany",Regional Grid,,1991-00-00,Stadtwerke Munchen,100,Municipal,,Stadtwerke Munchen,,,http://www.swm.de/privatkunden/unternehmen/energieerzeugung/erzeugungsanlagen/heizkraftwerke.html
Neurath BOA Coal Power Plant Germany,Germany,Operating Fully,51.035,6.6333,2200,Ultra-Super-Critical Thermal,Base Load,"Neurath, North Rhine-Westphalia, Germany",National Grid,Erft River,2012-08-15,RWE Power,,Private,"Alstom, Kraftanlagen München",RWE Power,,,http://www.rwe.com/web/cms/en/12068/rwe-power-ag/locations/lignite/kw-neurath-boa-2-3/
Neurath Coal Power Plant Germany,Germany,Operating Fully,51.03786,6.61206,2205,Sub-critical Thermal,Base Load,"Neurath, North Rhine-Westphalia, Germany",National Grid,Erft River,1972-00-00,RWE Power,,Private,,RWE Power,,,http://www.rwe.com/web/cms/en/60110/rwe-power-ag/locations/lignite/neurath-power-plant/
Niederaussem Coal Power Plant Germany,Germany,Operating Fully,50.9921,6.6666,3400,Sub-critical Thermal,Base Load,"Bergheim, North Rhine-Westphalia, Germany",National Grid,,1963-00-00,RWE Power,,,,RWE Power,,,http://www.rwe.com/web/cms/de/60132/rwe-power-ag/standorte/braunkohle/kw-niederaussem/
Reuter West CHP Coal Power Plant Germany,Germany,Operating Fully,52.535,13.2427,600,Sub-critical Thermal,Base Load,"Berlin, Germany",National Grid,Spree River,1987-00-00,Vattenfall,100,Private,,Vattenfall Europe Berlin AG & Co,,,http://kraftwerke.vattenfall.de/powerplant/reuter-west   http://powerplants.vattenfall.com/node/297
Rostock CHP Coal Power Plant Germany,Germany,Operating Fully,54.1414,12.1319,553,Sub-critical Thermal,Please Select,"Rostock, Mecklenburg-West Pomerania, Germany",National Grid,,1994-10-00,E.ON Power,45.7,,,Kraftwerks- und Netzgesellschaft mbH (KNG),,,http://www.kraftwerk-rostock.de/
Schkopau CHP Coal Power Station Germany,Germany,Operating Fully,51.39845,11.95032,916,Cogeneration Power and Heat Steam Turbine,Base Load,"Korbetha, Schkopau, Saxony-Anhalt, Germany",National Grid,Saale River,1995-00-00,E.ON Kraftwerke GmbH,58.1,Private,,E.ON Kraftwerke GmbH,,,http://www.eon-kraftwerke.com/pages/ekw_en/E.ON_Kraftwerke/Locations/index.htm
Scholven (Gelsenkirchen) Coal Power Plant Germany,Germany,Operating Fully,51.6024,7.00636,2200,Sub-critical Thermal,Base Load,"Scholven, Northrine-Westphalia, Germany",Regional Grid,,1948-00-00,E.ON Kraftwerke GmbH,,Private,,E.ON Kraftwerke GmbH,,,http://www.kraftwerk-scholven.com/pages/ekw_en/Scholven_Power_Plant/Overview/index.htm
Schwarze Pumpe Coal Power Plant Germany,Germany,Operating Fully,51.5357,14.3538,1600,Super-critical Thermal,Base Load,"Brandenburg, Germany",National Grid,,1997-00-00,vattenfall,100,Private,,Vattenfall Europe AG,,,http://powerplants.vattenfall.com/node/289
Shamrock Coal Power Plant Germany,Germany,Decommissioned,51.5283,7.179,120,Sub-critical Thermal,Please Select,"Holsterhausen, Herne, North Rhine-Westphalia, Germany",National Grid,,1957-00-00,E.ON Germany,,,,E.ON Germany,,,http://www.eon.com/en/about-us/structure/asset-finder/shamrock.html
Veltheim Coal Power Plant Germany,Germany,Operating Fully,52.1898,8.9335,320,Sub-critical Thermal,Please Select,"Porta Westfalica, North Rhine-Westphalia, Germany",National Grid,Weser River,1970-00-00,E.ON Kraftwerke GmbH,66.7,,,Gemeinschaftskraftwerk Veltheim GmbH,,,http://www.gk-veltheim.de/
Voerde Coal Power Plant Germany,Germany,Operating Fully,51.5771,6.6814,2234,Sub-critical Thermal,Base Load,"Voerde, North Rhine-Westphalia, Germany",National Grid,Rhine River,1970-00-00,STEAG GmbH,75,Private,,STEAG GmbH,,,http://www.steag.com/voerde+M52087573ab0.html   http://www.steag.com/voerde.html
Völklingen-Fens CHP Coal Power Plant Germany,Germany,Operating Fully,49.2489,6.8812,466,Cogeneration Power and Heat Steam Turbine,Please Select,"Völklingen, Saarland, Germany",National Grid,Saar River,1982-00-00,Steag Power GmbH,,,,Steag Power GmbH,,,http://www.steag.com/voelklingenfenne.html  http://power-saar.steag-saarenergie.de/en/index.php
Wedel CHP Power Plant Germany,Germany,Operating Fully,53.5667,9.72528,391.7,Sub-critical Thermal,Cogeneration,"Wedel, Schleswig-Holstein, Germany",Regional Grid,Elbe River,1965-00-00,Vattenfall,100,,,Vattenfall,,,http://powerplants.vattenfall.com/node/296
Weiher-3 (Quierschied) CHP Coal Power Plant Germany,Germany,Operating Fully,49.3347,7.0348,724,Sub-critical Thermal,Base Load,"Quierschied, Saarland, Germany",National Grid,Saar River,1976-00-00,Steag,,,Steag,Steag Power GmbH,,,http://www.steag.com/weiher.html   http://power-saar.steag-saarenergie.de/en/index.php
Weisweiler Coal Power Plant Germany,Germany,Operating Fully,50.8387,6.3219,2180,Sub-critical Thermal,Base Load,"Weisweiler, North Rhine-Westphalia, Germany",National Grid,,1955-00-00,RWE Generation SE,,,,RWE Generation SE,,,http://www.rwe.com/web/cms/en/60142/rwe-power-ag/locations/lignite/weisweiler-power-plant/
Werdohl-Elverlingsen E Coal Power Plant Germany,Germany,Operating Fully,51.27587,7.70679,487,Sub-critical Thermal,Please Select,"North of Elverlingsen, North Rhine-Westphalia, Germany",National Grid,Lenne River,1971-00-00,Mark-E Aktiengesellschaft (Hagen),,,,Mark-E,,,http://www.mark-e.de/Desktopdefault.aspx/tabid-63/49_read-71
Werne (Gersteinwerk Block K) Coal Power Plant Germany,Germany,Operating Fully,51.6739,7.7195,770,Sub-critical Thermal,Base/Intermediate Load,59368 Werne Hammer Straße 2 Germany,National Grid,Lippe River,1984-00-00,RWE,100,Private,,RWE Gneration,,,werne-gersteinwerk-power-plants-pdf.pdf
Westfalen Coal Power Plant Germany,Germany,Operating Fully,51.6805,7.9696,305,Sub-critical Thermal,Base/Intermediate Load,"Siegenbeckstraße, Hamm-Uentrop, Germany",National Grid,Datteln-Hamm Canal,1963-00-00,RWE Power,100,Private,,RWE Power,,,http://www.rwe.com/web/cms/de/1770974/rwe-generation-se/standorte/deutschland/kw-westfalen/
Westfalen Hamm Coal Power Plant Germany,Germany,Operating Fully,51.6766,7.9724,1600,Super-critical Thermal,Base Load,"Uentrop-Schmehausen, North Rhine-Westphalia, Germany",National Grid,Lippe River,2014-00-00,RWE Power,,,,RWE Power,,,http://www.rwe.com/web/cms/mediablob/en/331230/data/12428/4/rwe-power-ag/power-plant-new-build/westfalen-power-station-units-d-and-e/Westfalen-Power-Plant-New-build-project-units-d-and-e.pdf
Wilhelmshaven Coal Power Plant Germany,Germany,Operating Fully,53.5647,8.1469,757,Sub-critical Thermal,Base Load,"Wilhelmshaven, Lower Saxony, Germany",National Grid,Seawater,1976-00-00,E.ON Kraftwerke GmbH,100,Private,,E.ON Kraftwerke GmbH,,,http://www.eon.com/de/ueber-uns/struktur/asset-finder/wilhelmshaven.html
Zolling Coal CHP Power Plant Germany,Germany,Operating Fully,48.4554,11.8017,474,Sub-critical Thermal,Base Load,"Zolling, Freising, Bavaria, Germany",National Grid,Amper River,1986-00-00,GDF SUEZ (swap with E.ON in 2009),100,,,GDF SUEZ Energie Deutschland AG,,,https://www.gdfsuez-energie.de/de/erzeugung/erzeugungsanlagen/zolling
Aghios Dimitrios Coal Power Plant Greece,Greece,Operating Fully,40.3933,21.9249,1595,Sub-critical Thermal,Base Load,"near Agios Dimitrios, Kozani, Greece",National Grid,,1984-00-00,Public Power Corp (DEH),,Government,Alsaldo (unit 5),Public Power Corp (DEH),,,http://www.dei.gr/Default.aspx?id=146&nt=123&lang=2
Aminteo (Amyntaio)  Coal Power Plant Greece,Greece,Operating Fully,40.6191,21.6838,600,Sub-critical Thermal,Base Load,"near Amyntaio, Florina, Western Macedonia, Greece",National Grid,,1987-00-00,Public Power Corp (DEH),,Government,,Public Power Corp (DEH),,,http://www.dei.gr/Default.aspx?id=146&nt=123&lang=2
Florina  Coal Power Plant Greece,Greece,Operating Fully,40.8114,21.6014,330,Super-critical Thermal,Base Load,"Meliti, Ahlada, Florina, Western Macedonia, Greece",National Grid,,2003-10-02,Public Power Corp (DEH),,Government,Alstom,Public Power Corp (DEH),,,http://www.dei.gr/Default.aspx?id=146&nt=123&lang=2
Kardia  Coal Power Plant Greece,Greece,Operating Fully,40.4105,21.7851,1250,Sub-critical Thermal,Base Load,"Kozani, West Macedonia, Kozani, Greece",National Grid,,1975-00-00,Public Power Corp (DEH),,,,Public Power Corp (DEH),,,http://www.dei.gr/Default.aspx?id=146&nt=123&lang=2
Megalopoli Coal Power Plant Greece,Greece,Operating Fully,37.418,22.1083,850,Sub-critical Thermal,Base Load,"near Megalopoli, Arcadia, Peloponnese, Greece",National Grid,Alpheus River,1970-00-00,Public Power Corp (DEH),,Government,,Public Power Corp (DEH),,,http://www.dei.gr/Default.aspx?id=146&nt=123&lang=2
Ptolemais Coal Power Plant Greece,Greece,Operating Fully,40.4807,21.7282,550,Sub-critical Thermal,Base Load,"Kozani, West Macedonia, Kozani, Greece",National Grid,,1959-00-00,Public Power Corp (DEH),,Government,,Public Power Corp (DEH),,,http://www.dei.gr/Default.aspx?id=146&nt=123&lang=2
